-- MySQL dump 10.13  Distrib 5.6.43, for Linux (x86_64)
--
-- Host: localhost    Database: SS_DHarrisTours
-- ------------------------------------------------------
-- Server version	5.6.43

/*!40101 SET @OLD_CHARACTER_SET_CLIENT=@@CHARACTER_SET_CLIENT */;
/*!40101 SET @OLD_CHARACTER_SET_RESULTS=@@CHARACTER_SET_RESULTS */;
/*!40101 SET @OLD_COLLATION_CONNECTION=@@COLLATION_CONNECTION */;
/*!40101 SET NAMES utf8 */;
/*!40103 SET @OLD_TIME_ZONE=@@TIME_ZONE */;
/*!40103 SET TIME_ZONE='+00:00' */;
/*!40014 SET @OLD_UNIQUE_CHECKS=@@UNIQUE_CHECKS, UNIQUE_CHECKS=0 */;
/*!40014 SET @OLD_FOREIGN_KEY_CHECKS=@@FOREIGN_KEY_CHECKS, FOREIGN_KEY_CHECKS=0 */;
/*!40101 SET @OLD_SQL_MODE=@@SQL_MODE, SQL_MODE='NO_AUTO_VALUE_ON_ZERO' */;
/*!40111 SET @OLD_SQL_NOTES=@@SQL_NOTES, SQL_NOTES=0 */;

--
-- Table structure for table `Invoice`
--

DROP TABLE IF EXISTS `Invoice`;
/*!40101 SET @saved_cs_client     = @@character_set_client */;
/*!40101 SET character_set_client = utf8 */;
CREATE TABLE `Invoice` (
  `InvoiceID` int(11) NOT NULL AUTO_INCREMENT,
  `Invoice` varchar(100) DEFAULT NULL,
  `JobID` int(11) DEFAULT NULL,
  `Description` varchar(250) DEFAULT NULL,
  `InvoiceDate` varchar(50) DEFAULT NULL,
  `InvoiceAmt` float DEFAULT NULL,
  `Tax` varchar(50) DEFAULT NULL,
  `StartTime` varchar(50) DEFAULT NULL,
  `EndTime` varchar(50) DEFAULT NULL,
  `BillableHours` varchar(50) DEFAULT NULL,
  `PaidAmt` varchar(50) DEFAULT NULL,
  `Balance` varchar(50) DEFAULT NULL,
  `CheckNum` varchar(50) DEFAULT NULL,
  `CheckDate` varchar(50) DEFAULT NULL,
  `Notes` text,
  `Created` datetime DEFAULT NULL,
  `LastModified` timestamp NOT NULL DEFAULT CURRENT_TIMESTAMP ON UPDATE CURRENT_TIMESTAMP,
  `CreatedBy` varchar(100) DEFAULT NULL,
  `LastModifiedBy` varchar(100) DEFAULT NULL,
  `InvoiceSent` tinyint(4) NOT NULL DEFAULT '0',
  `Gas` decimal(10,0) DEFAULT NULL,
  `MiscCost` decimal(10,0) DEFAULT NULL,
  PRIMARY KEY (`InvoiceID`),
  KEY `JobID` (`JobID`)
) ENGINE=InnoDB AUTO_INCREMENT=14987 DEFAULT CHARSET=utf8;
/*!40101 SET character_set_client = @saved_cs_client */;

--
-- Dumping data for table `Invoice`
--

LOCK TABLES `Invoice` WRITE;
/*!40000 ALTER TABLE `Invoice` DISABLE KEYS */;
INSERT INTO `Invoice` VALUES (1406,'Quarry Lane  Field Trip 1406',665,'Prepayment','2010-09-29',797,'','10:00','17:30','7.5','797','0','22667','09/29/10',' Invoice Amt: 797','2010-09-22 21:42:55','2013-03-18 06:44:54',NULL,NULL,0,NULL,NULL),(1407,'Day of the Dead Celebration 1407',669,'Total 2 Bus 55 per bus, Bus 1 Junipero Serra Time 11:30am to 16:00','2010-10-23',1480,'','8:30 Bus 2 Good Samaritan','16:00','12','1480','0','75869','10/28/2010','Jobs 669 - 671 are for this invoice Invoice Amt: 1480','2010-09-28 23:51:48','2013-03-18 06:44:54',NULL,NULL,0,NULL,NULL),(1426,'Marshall HS 1426',610,'G volley Paid check 605114 date 11-05-2010','2010-10-10',375,'','14.30','18:30','4','375','0','605114','2010-11-05',' Invoice Amt: 375','2010-10-10 17:20:15','2013-03-18 06:44:54',NULL,NULL,0,NULL,NULL),(1430,'Washington Elem WCC 1430',707,'Audubon Paid check 431655 date 11-03-10','2010/10/10',595,'','8:30','One Way ','6','595.00','0','431655','2010-11-03',' Invoice Amt: 595','2010-10-10 23:02:50','2013-03-18 06:44:54',NULL,NULL,0,NULL,NULL),(1431,'Audubon Canyon 1431',708,'Washington WCC Paid check 431655 date 11-03-10','2010-10-10',595,'','1:00 pm','14:30','6','595','0','431655','2010-11-03',' Invoice Amt: 595','2010-10-10 23:12:41','2013-03-18 06:44:54',NULL,NULL,0,NULL,NULL),(1432,'George Washington HS 1432',658,'Great America','2010-10-10',600,'','9:00','19:00','2 transfers','600.00','0','10279','','see invoice 1379 Invoice Amt: 600','2010-10-10 23:58:17','2013-03-18 06:44:54',NULL,NULL,0,NULL,NULL),(1433,'McCarthur 35th Av Oakland 1433',723,'Cancellation not enought students','',175,'','11:30','','','175','0','003730','11/10/10',' Invoice Amt: 175','2010-10-11 00:03:37','2013-03-18 06:44:54',NULL,NULL,0,NULL,NULL),(1434,'De Anza G Volleyball 1434',712,'Alameda HS','2010-10-10',535,'','14:30','20:30','6','535.00','0','431905','11-10-2010','old system paid  Invoice Amt: 535','2010-10-11 00:18:23','2013-03-18 06:44:54',NULL,NULL,0,NULL,NULL),(1435,'Quarry Lane First Grade 1435',709,'check 22689 date 2010-10-12','2010-10-11',725,'','11:30','14:50','4','725','0','22689','2010 10 12',' Invoice Amt: 725','2010-10-11 10:45:59','2013-03-18 06:44:54',NULL,NULL,0,NULL,NULL),(1436,'Quarry Lane Kinder 1436',713,'Pumpkin Patch Livermore','2010-10-11',725,'','9:00','12:30','4','725','0','22691','2010-10-13',' Invoice Amt: 725','2010-10-11 10:53:22','2013-03-18 06:44:54',NULL,NULL,0,NULL,NULL),(1437,'Quarry Lane 4th Grade 1437',737,'Coloma One way','2010-10-11',975,'','8:00','One way transfer','','975','0','22692','2010-10-13',' Invoice Amt: 975','2010-10-11 11:03:38','2013-03-18 06:44:54',NULL,NULL,0,NULL,NULL),(1438,'void 1438 VOIDED INVOICE',0,'autofilling missing invoice numbers',NULL,NULL,NULL,NULL,NULL,NULL,NULL,NULL,NULL,NULL,'Invoice- Invoice Amt:  0',NULL,'2013-03-18 06:44:54',NULL,NULL,0,NULL,NULL),(1439,'Quarry Lane 4th 1439',738,'Coloma one way','2010-10-11',975,'','12:30','One way transfer','One way transfer','975','0','22692','2010-13-10',' Invoice Amt: 975','2010-10-11 11:12:00','2013-03-18 06:44:54',NULL,NULL,0,NULL,NULL),(1440,'Quarry Lane Chabot 1440',648,'Paid check 22710 date10-20-10','',920,'','8:45','15:00','6.25','920','0','22710','10/20/2010',' Invoice Amt: 920','2010-10-13 13:51:13','2013-03-18 06:44:54',NULL,NULL,0,NULL,NULL),(1441,'Quarry Lane  SF Zoo 1441',740,'SF Zoo Paid check 22731 date 10-20-10 invoice 1441','2010-11-08',755,'','8:10','15:00','7','755','0','22731','2010-10-20',' Invoice Amt: 755','2010-10-14 21:23:30','2013-03-18 06:44:54',NULL,NULL,0,NULL,NULL),(1442,'Quarry Lane Bankhead 1442',649,'','2010-11-18',725,'','10:15','13:15','4','725.00','0','22812','12-03-2010','2nd grade field trip paid Invoice Amt: 725','2010-10-14 21:52:35','2013-03-18 06:44:54',NULL,NULL,0,NULL,NULL),(1443,'St. Helena 1443',726,'','2010-10-10',450,'','','','','450.00','0','3730','','old system paid  Invoice Amt: 450','2010-10-14 22:04:32','2013-03-18 06:44:54',NULL,NULL,0,NULL,NULL),(1444,'Quarry Lane 1444',732,'Sempervirens drop off','2010-10-14',778,'','11:00','00:00','One Way','778.00','0','22730','2010-10-20',' Invoice Amt: 778','2010-10-14 22:07:40','2013-03-18 06:44:54',NULL,NULL,0,NULL,NULL),(1445,'Quarry Lane 1445',731,'Sempervirens Dropoff','2010-10-14',778,'','08:00','00:00','One Way','778.88','0','22730','2010-10-20',' Invoice Amt: 778','2010-10-14 22:19:00','2013-03-18 06:44:54',NULL,NULL,0,NULL,NULL),(1446,'Quarry Lane 1446',714,'Paid check 22741 date 11/1/10 Bankhead','2010-11-02',725,'','11:30','14:50','4','725','0','22741','11/1/10','Frances  Invoice Amt: 725','2010-10-14 22:29:29','2013-03-18 06:44:54',NULL,NULL,0,NULL,NULL),(1447,'Quarry Lane 1447',736,'Old Mission San Jose','2010-12-07',585,'','09:00','14:00','5','585.00','0','22814','2010-12-03',' Invoice Amt: 585','2010-10-15 08:52:07','2013-03-18 06:44:54',NULL,NULL,0,NULL,NULL),(1448,'Quarry Lane 1448',720,'Elk Shoe','2010-12-15',725,'','08:30','11:45','4','725.00','0','22957','2010-12-15',' Invoice Amt: 725','2010-10-15 08:56:26','2013-03-18 06:44:54',NULL,NULL,0,NULL,NULL),(1449,'Empire 1449',763,'view of the Bay Bridge','2010-10-17',360,'','10:15','13:45','4','','','','','job cancel Invoice Amt: 360','2010-10-15 11:37:39','2013-03-18 06:44:54',NULL,NULL,0,NULL,NULL),(1450,'Empire 1450',764,'One Way to Milpitas','2010-10-17',360,'','20:00','23:00','4','','','','','cancel Invoice Amt: 360','2010-10-15 11:48:55','2013-03-18 06:44:54',NULL,NULL,0,NULL,NULL),(1451,'SFUSD 1451',759,'Check 1155 date 10-22-10','2010-10-15',687.5,'','08:00','15:30','7.5','687.5','0','1155','2010-10-22',' Invoice Amt: 687.5','2010-10-15 17:13:10','2013-03-18 06:44:54',NULL,NULL,0,NULL,NULL),(1452,'Gateway HS 1452',770,'Paid check 7420 date 10-31-10 invoice 1452','2010-10-07',497.5,'','14:00','19:30','5.5','497.50','0','7420','',' Invoice Amt: 497.5','2010-10-17 15:43:56','2013-03-18 06:44:54',NULL,NULL,0,NULL,NULL),(1453,'Bojour Transportation 1453',771,'SF Communiity School','2010-10-17',375,'','9:30','One way transfer','','paid','','','',' Invoice Amt: 375','2010-10-17 16:07:10','2013-03-18 06:44:54',NULL,NULL,0,NULL,NULL),(1454,'ISA  1454',616,'Lincoln HS Paid check 605114 date 2010-11-05 invoice 1454','2010-10-17',325,'','14:45','One way transfer','','325','0','605114','2010-11-05','Emailed 10/19 Invoice Amt: 325','2010-10-17 16:36:15','2013-03-18 06:44:54',NULL,NULL,0,NULL,NULL),(1455,'void',0,'autofilling missing invoice numbers',NULL,NULL,NULL,NULL,NULL,NULL,NULL,NULL,NULL,NULL,'Invoice- Invoice Amt:  0',NULL,'2013-03-18 06:44:54',NULL,NULL,0,NULL,NULL),(1456,'De Anza HS 1456',765,'Football Team','2010-10-15',702.5,'','14:00','21.5','7.5','702.5','0','431905','11/10/10','sent 10/19 Invoice Amt: 702.5','2010-10-17 22:44:10','2013-03-18 06:44:54',NULL,NULL,0,NULL,NULL),(1457,'SFUSD Wallenber HS  1457',612,'Paid check 605114 date 2010-11-05','2010-10-19',572.5,'','14:15','19:35','5.25','572.50','0','605114','2010-11-05','Sent 10/19 Invoice Amt: 572.5','2010-10-19 10:47:47','2013-03-18 06:44:54',NULL,NULL,0,NULL,NULL),(1458,'Event West P O #205094 1458',752,'Paid check 100186 date 11-06-10','2010-10-19',880,'','8:30','20:30','10','880','0','100186','2010-11-06','send 2010-10-19 Invoice Amt: 880','2010-10-19 11:13:29','2013-03-18 06:44:54',NULL,NULL,0,NULL,NULL),(1459,'void 1459 VOIDED INVOICE',0,'autofilling missing invoice numbers',NULL,NULL,NULL,NULL,NULL,NULL,NULL,NULL,NULL,NULL,'Invoice- Invoice Amt:  0',NULL,'2013-03-18 06:44:54',NULL,NULL,0,NULL,NULL),(1460,'void 1460 VOIDED INVOICE ',0,'autofilling missing invoice numbers',NULL,NULL,NULL,NULL,NULL,NULL,NULL,NULL,NULL,NULL,'Invoice- Invoice Amt:  0',NULL,'2013-03-18 06:44:54',NULL,NULL,0,NULL,NULL),(1461,'Lowell HS 1461',614,'G Volleyball','2010-10-18',468.75,'','15:15','19:30','4.5','468.75','0','607116','12-02-2010',' Invoice Amt: 468.75','2010-10-23 17:41:37','2013-03-18 06:44:54',NULL,NULL,0,NULL,NULL),(1462,'De Anza G Volleyball 1462',768,'El Cerrito HS','2010-10-19',460,'','15:00','19:30','4.5','','','','',' Invoice Amt: 460','2010-10-23 17:58:57','2013-03-18 06:44:54',NULL,NULL,0,NULL,NULL),(1463,'De Anza G Volleyball 1463',795,'G Volleyball Duplicate 1634','2010-10-21',460,'','15:00','20:00','5','paid','','','',' Invoice Amt: 460','2010-10-23 19:39:27','2013-03-18 06:44:54',NULL,NULL,0,NULL,NULL),(1464,'James Denman B Basketball 1464',703,'','2010-10-22',375,'','14:15','17:30','4','375.00','0','607116','12-02-2010',' Invoice Amt: 375','2010-10-23 19:53:04','2013-03-18 06:44:54',NULL,NULL,0,NULL,NULL),(1465,'Josh Park Presidio 1465',671,'2nd run 3101 Mission St San Fco 1 bus 37passengers','2010-10-23',517.5,'','11:30','16:00','4.5','517.5','0','75869','10/28/2010',' Invoice Amt: 517.5','2010-10-23 20:20:18','2013-03-18 06:44:54',NULL,NULL,0,NULL,NULL),(1466,'Park Conservancy Josh 1466',753,'Aptos Middle ','2010-10-21',325,'','13:00','18:00','4','325','0','75869','10/28/2010',' Invoice Amt: 325','2010-10-23 21:19:52','2013-03-18 06:44:54',NULL,NULL,0,NULL,NULL),(1467,'Park Conservancy Josh 1467',769,'McKinley Elem ','2010-10-22',550,'','14:45','17:00','4','550','0','75869','10/28/2010',' Invoice Amt: 550','2010-10-23 21:33:14','2013-03-18 06:44:54',NULL,NULL,0,NULL,NULL),(1468,'St Helena HS 1468',726,'Cross Country','2010-10-20',652.5,'','13:30','19:00','5.5','652.5','0','0000723898','11/10/10',' Invoice Amt: 652.5','2010-10-23 21:59:46','2013-03-18 06:44:54',NULL,NULL,0,NULL,NULL),(1469,'De Anza Football 1469',766,'El Cerrito HS','2010-10-22',751.25,'','14:00','22:15','8.25','paid','','','',' Invoice Amt: 751.25','2010-10-23 22:07:27','2013-03-18 06:44:54',NULL,NULL,0,NULL,NULL),(1470,'Ap Giannini MD 1470',675,'B Basketball','2010-10-22',325,'','14:15','One Way','','325.00','0','607116','12-02-2010',' Invoice Amt: 325','2010-10-23 22:19:01','2013-03-18 06:44:54',NULL,NULL,0,NULL,NULL),(1471,'ISA HS 1471',617,'Galileo','2010-10-22',325,'','14:45','One Way','','325.00','0','607116','12-02-2010',' Invoice Amt: 325','2010-10-23 22:44:36','2013-03-18 06:44:54',NULL,NULL,0,NULL,NULL),(1472,'Invoice 1387',782,'Old System','2010-10-20',795,'','','','','795','0','431139','10-20-2010',' Invoice Amt: 795','2010-10-24 19:56:16','2013-03-18 06:44:54',NULL,NULL,0,NULL,NULL),(1473,'De Anza  1369',783,'Old System','2010-09-09',550,'0','14:15:00','20:00:00','6','550','0','431139','10-20-2010','Invoice- Invoice Amt: 550','2010-10-24 20:00:34','2013-03-18 06:44:54',NULL,NULL,0,NULL,NULL),(1474,'Pinole HS invoice 1388',785,'Old System','2010-09-03',712.5,'0','14:30:00','22:00:00','7.5','712.5','0','431139','10-20-2010','Invoice- Invoice Amt: 712.5','2010-10-24 20:00:34','2013-03-18 06:44:54',NULL,NULL,0,NULL,NULL),(1475,'Pinole HS invoice 1389',786,'Old System','2010-09-03',650,'0','16:00:00','22:00:00','6','650','0','431139','10-20-2010','Invoice- Invoice Amt: 650','2010-10-24 20:00:34','2013-03-18 06:44:54',NULL,NULL,0,NULL,NULL),(1476,'Pinole HS invoice 1390',787,'Old System','2010-09-17',985,'0','14:00:00','22:00:00','8','985','0','431139','10-20-2010','Invoice- Invoice Amt: 985','2010-10-24 20:00:34','2013-03-18 06:44:54',NULL,NULL,0,NULL,NULL),(1477,'Pinole HS invoice 1391',788,'Old System','2010-09-17',890,'0','16:00:00','23:00:00','7','890','0','431139','10-20-2010','Invoice- Invoice Amt: 890','2010-10-24 20:00:34','2013-03-18 06:44:54',NULL,NULL,0,NULL,NULL),(1478,'Pinole HS INVOICE 1407',790,'Old System','2010-09-23',1840.9,'0','07:30:00','15:30:00','8','1840.9','0','431139','10-20-2010','Invoice- Invoice Amt: 1840.9','2010-10-24 20:00:34','2013-03-18 06:44:54',NULL,NULL,0,NULL,NULL),(1479,'De Anza INVOICE 1411',791,'Old System','2010-09-21',497.5,'0','15:00:00','20:30:00','5.5','497.5','0','431139','10-20-2010','Invoice- Invoice Amt: 497.5','2010-10-24 20:00:34','2013-03-18 06:44:54',NULL,NULL,0,NULL,NULL),(1480,'Pinole HS INVOICE 1412',792,'Old System','2010-09-24',845,'0','08:30:00','15:30:00','7','845','0','431139','10-20-2010','Invoice- Invoice Amt: 845','2010-10-24 20:00:34','2013-03-18 06:44:54',NULL,NULL,0,NULL,NULL),(1481,'De Anza HS INVOICE 1394',793,'Old System','2010-09-15',550,'0','14:00:00','00:00:20','6','550.00','0','720826','12-20-2010','Invoice- Invoice Amt: 550','2010-10-24 20:00:34','2013-03-18 06:44:54',NULL,NULL,0,NULL,NULL),(1482,'De Anza HS INVOICE 1419',794,'Old System','2010-09-30',460,'0','13:00:00','18:00:00','5','INVOICE 1419','0','INVOICE 1419','INVOICE 1419','Invoice- Invoice Amt: 460','2010-10-24 20:00:34','2013-03-18 06:44:54',NULL,NULL,0,NULL,NULL),(1483,'Ritz Carlton Half Moon Bay 1483',773,'check 1352 date 10-28-2010 Balance 0','2010-10-28',225,'','15:00','One Way transfer','2','225','0','1352','10-28-2010',' Invoice Amt: 225','2010-10-28 21:53:47','2013-03-18 06:44:54',NULL,NULL,0,NULL,NULL),(1484,'SFUSD Giannini MD 1484',676,'G Basketball','2010-10-27',375,'','14:15','17:15','4','375.00','0','607116','12-02-2010',' Invoice Amt: 375','2010-10-28 22:33:04','2013-03-18 06:44:54',NULL,NULL,0,NULL,NULL),(1485,'SFUSD Mission HS 1485',760,'Field Trip','2010-10-27',687.5,'','8:15','15:30','7','687.50','0','606964','2101-12-01',' Invoice Amt: 687.5','2010-10-28 22:53:14','2013-03-18 06:44:54',NULL,NULL,0,NULL,NULL),(1486,'Kevin Earth Team 1486',758,'37 passenger bus','2010-10-28',450,'','10:15','15:15','5','450','0','003732','11/10/10',' Invoice Amt: 450','2010-10-28 23:04:17','2013-03-18 06:44:54',NULL,NULL,0,NULL,NULL),(1487,'void',0,'autofilling missing invoice numbers',NULL,NULL,NULL,NULL,NULL,NULL,NULL,NULL,NULL,NULL,'Invoice- Invoice Amt:  0',NULL,'2013-03-18 06:44:54',NULL,NULL,0,NULL,NULL),(1488,'Gateway HS 1488',805,'Paid check 7420 date 10-31-10 invoice 1488','2010-10-26',285,'','13:00','One Way transfer','','','','','',' Invoice Amt: 285','2010-10-30 21:56:00','2013-03-18 06:44:54',NULL,NULL,0,NULL,NULL),(1489,'Gateway HS 1489',813,'Paid check 7420 date 10-31-10 invoice 1489','2010-10-28',285,'','14:00','One Way transfer','','','','','',' Invoice Amt: 285','2010-10-30 22:31:04','2013-03-18 06:44:54',NULL,NULL,0,NULL,NULL),(1490,'Galileo Invoice 1365',639,'Old System Invoice, Bus Size 38','',535,'','','','','535.00','0','604544','10-27-2010','old system Invoice Amt: 535','2010-10-31 21:16:46','2013-03-18 06:44:54',NULL,NULL,0,NULL,NULL),(1491,'Event West P O #205337 1491',815,'Paid check 100187 date 11/6/10 invoice 1491','2010-11-03',360,'','09:30','13:00','4','360','0','100187','20/11/0106','Andy job Invoice Amt: 360','2010-11-03 08:27:43','2013-03-18 06:44:54',NULL,NULL,0,NULL,NULL),(1492,'void AUTOFILLING MISSING NUMBER',0,'autofilling missing invoice numbers',NULL,NULL,NULL,NULL,NULL,NULL,NULL,NULL,NULL,NULL,'Invoice- Invoice Amt:  0',NULL,'2013-03-18 06:44:54',NULL,NULL,0,NULL,NULL),(1493,'SFUSD Mission HS Pie Ranch 1493',761,'Pie Ranch','2010-11-04',687.5,'','8:00','15:30','7.5','687.50','0','606964','2010-12-01',' Invoice Amt: 687.5','2010-11-06 09:29:29','2013-03-18 06:44:54',NULL,NULL,0,NULL,NULL),(1494,'Hany Limousine 1494',832,'','2010-10-16',360,'','16:00','20:00','4','360','0','    1215 ','2010-10-16',' Invoice Amt: 360','2010-11-07 23:15:59','2013-03-18 06:44:54',NULL,NULL,0,NULL,NULL),(1495,'St Helena HS 1495',727,'Willit HS Paid 12-01-10 Check 724897','2010-11-03',865,'','12:30','20:15','8','865.00','0','724897','2010-12-01',' Invoice Amt: 865','2010-11-08 22:37:25','2013-03-18 06:44:54',NULL,NULL,0,NULL,NULL),(1496,'Ellen Fisher 1496',781,'Oakland Zoo','2010-11-03',722.5,'','8:30','17:00','8.5','722.50','0','18444','','old system paid Invoice Amt: 722.5','2010-11-08 22:51:18','2013-03-18 06:44:54',NULL,NULL,0,NULL,NULL),(1497,'Gateway sub 1497',818,'Santa Rosa','2010-11-03',836.25,'','15:00','23:15','8.15','836.25','0','7503','11-23-2010','old system Invoice Amt: 836.25','2010-11-08 23:33:37','2013-03-18 06:44:54',NULL,NULL,0,NULL,NULL),(1498,'De Anza G Volleyball 1498',796,'G Volleyball','2010-11-04',478.75,'','15:00','20:15','5.15','478.75','0','432565','12-2-2010','old system Invoice Amt: 478.75','2010-11-08 23:46:01','2013-03-18 06:44:54',NULL,NULL,0,NULL,NULL),(1499,'Galileo HS 1499',618,'Bus was change to 47 passenger do to number of students','2010-11-04',595,'','14:30','19:30','5','595.00','0','607116','12-02-2010',' Invoice Amt: 595','2010-11-08 23:55:49','2013-03-18 06:44:54',NULL,NULL,0,NULL,NULL),(1500,'James Denman G Basket 1500',704,'william Brown','2010-11-05',375,'','14:14','17:30','','375.00','0','607116','12-02-2010',' Invoice Amt: 375','2010-11-09 00:06:07','2013-03-18 06:44:54',NULL,NULL,0,NULL,NULL),(1501,'Giannini 1501',677,'ISA','2010-11-05',325,'','14:15','One Way Transfer','','325.00','0','607116','12-02-2010',' Invoice Amt: 325','2010-11-09 00:11:17','2013-03-18 06:44:54',NULL,NULL,0,NULL,NULL),(1502,'Event West P O 1502',831,'Sonoma wedding Check 100204','2010-11-06',640,'','14:30','22:30','8','640','0','100204','11-15-10',' Invoice Amt: 640','2010-11-09 22:22:36','2013-03-18 06:44:54',NULL,NULL,0,NULL,NULL),(1503,'Gateway HS 1503',820,'','2010-11-06',1825.5,'','11:00','1:00','14','1825.00','0','7503','11-23-2010','Peninsula Tour Invoice Amt: 1825.5','2010-11-09 23:35:07','2013-03-18 06:44:54',NULL,NULL,0,NULL,NULL),(1504,'Event West P O #205346 1504',830,'Paid check 100203 date 11-15-10','2010-11-06',580,'','15:00','22:30','7.5','580','0','100203','11-15-10',' Invoice Amt: 580','2010-11-12 21:38:54','2013-03-18 06:44:54',NULL,NULL,0,NULL,NULL),(1505,'St Helena HS 1505',728,'','2010-11-10',822.5,'','11:30','19:00','7.5','822.00','0','724897','2010-12-01',' Invoice Amt: 822.5','2010-11-13 11:00:15','2013-03-18 06:44:54',NULL,NULL,0,NULL,NULL),(1506,'St Helena HS 1506',844,'G Volleyball','2010-11-13',600,'','16:15','22:30','6','','','','',' Invoice Amt: 600','2010-11-14 15:11:10','2013-03-18 06:44:54',NULL,NULL,0,NULL,NULL),(1507,'SFUSD AP Giannini 1507',678,'G Basketball','2010-11-10',325,'','14:15','One Way transfer','','325.00','0','607116','12-02-2010',' Invoice Amt: 325','2010-11-14 15:22:13','2013-03-18 06:44:54',NULL,NULL,0,NULL,NULL),(1508,'Hoover MS SFUSD 1508',754,'','2010-11-10',375,'','14:00','15:30','4','375.00','0','607116','12-02-2010',' Invoice Amt: 375','2010-11-14 15:27:13','2013-03-18 06:44:54',NULL,NULL,0,NULL,NULL),(1509,'WCC Richmond HS Field Trip 1509',839,'State University East Bay','2010-11-13',650,'','8:30','15:00','6.5','650.00','0','432320','2010-23-10',' Invoice Amt: 650','2010-11-14 16:45:42','2013-03-18 06:44:54',NULL,NULL,0,NULL,NULL),(1510,'De Anza Old System 1418 1510',803,'Invoice 1418 from Old System','2010-09-29',460,'','','','','460','0','431905','11/10/10',' Invoice Amt: 460','2010-11-15 16:46:19','2013-03-18 06:44:54',NULL,NULL,0,NULL,NULL),(1511,'De Anza Old System 1419 1511',794,'Invoice 1419 from Old System','2010-09-30',460,'','','','','460','0','431905','11/10/10',' Invoice Amt: 460','2010-11-15 16:47:24','2013-03-18 06:44:54',NULL,NULL,0,NULL,NULL),(1512,'De Anza Old System 1424 1512',799,'Invoice 1424 from Old System','10/3/10',1475,'','','','','1475','0','431905','11/10/10',' Invoice Amt: 1475','2010-11-15 16:50:12','2013-03-18 06:44:54',NULL,NULL,0,NULL,NULL),(1513,'De Anza Old System 1434 1513',712,'Invoice 1434 from Old System','10/7/10',535,'','','','','535','0','431905','11/10/10',' Invoice Amt: 535','2010-11-15 16:52:14','2013-03-18 06:44:54',NULL,NULL,0,NULL,NULL),(1514,'De Anza Old System 1421 1514',858,'Old System 1421','10/1/10',775,'','','','','775','0','431905','',' Invoice Amt: 775','2010-11-15 17:05:23','2013-03-18 06:44:54',NULL,NULL,0,NULL,NULL),(1515,'SFUSD Old System 1405',607,'Old System 1405 - cancellation fee','2010-09-16',150,'','','','','150','0','60544','10/27/10','-- Updated by juanaharris@sbcglobal.net on 4/4/2012 at 10:39:10 PM\r\n Invoice Amt: 150','2010-11-15 17:19:55','2013-03-18 06:44:54',NULL,NULL,0,NULL,NULL),(1516,'Kevin Skyline HS 1516',835,'','2010-11-16',400,'','11:30','15:00','3.5','','','','',' Invoice Amt: 400','2010-11-15 23:47:59','2013-03-18 06:44:54',NULL,NULL,0,NULL,NULL),(1517,'Kevin Earth 1517',836,'','2010-11-18',350,'','11:30','15:00','4','','','','',' Invoice Amt: 350','2010-11-15 23:53:38','2013-03-18 06:44:54',NULL,NULL,0,NULL,NULL),(1518,'Quarry Lane Soccer game 1518',843,'Soccer game Paid 11-2502010 check 22865','2010-11-16',450,'','15:00','18:00','4','450','0','22865','2010-11-25',' Invoice Amt: 450','2010-11-16 23:33:49','2013-03-18 06:44:54',NULL,NULL,0,NULL,NULL),(1519,'Pinole HS Boys Soccer 1519',863,'Boys Soccer Team','2010-11-17',665,'','13:30','18:30','5','','','','',' Invoice Amt: 665','2010-11-18 19:49:10','2013-03-18 06:44:54',NULL,NULL,0,NULL,NULL),(1520,'SFUSD Hoover MS 1520',755,'B Basket','2010-11-17',375,'','14:05','17:45','4','375.00','0','607710','2010-11-17',' Invoice Amt: 375','2010-11-18 21:53:55','2013-03-18 06:44:54',NULL,NULL,0,NULL,NULL),(1521,'WCC Richmond HS 1521',819,'Field Trip','2010-11-18',385,'','12:30','15:30','4','385.00','0','935653','12-28-2010',' Invoice Amt: 385','2010-11-18 22:07:04','2013-03-18 06:44:54',NULL,NULL,0,NULL,NULL),(1522,'WCC De Anza HS 1522',857,'Boys Basketball Team','2010-11-18',650,'','14:15','20:45','6.5','','','','',' Invoice Amt: 650','2010-11-18 22:22:56','2013-03-18 06:44:54',NULL,NULL,0,NULL,NULL),(1523,'WCC De Anza HS 1523',860,'G Soccer game','2010-11-18',535,'','14:15','20:15','6','','','','',' Invoice Amt: 535','2010-11-18 22:46:49','2013-03-18 06:44:54',NULL,NULL,0,NULL,NULL),(1524,'SFUSD Giannini 1524',679,'','2010-11-19',325,'','14:15','One Way Transfer','','325.00','0','609901','1-11-2011',' Invoice Amt: 325','2010-11-26 22:17:48','2013-03-18 06:44:54',NULL,NULL,0,NULL,NULL),(1525,' Hoover VOID DUPLICATE  1525',755,'Void Duplicate,','2010-11-17',375,'','14.05','17.45','4','','','','','correct invoice 1520 Invoice Amt: 375','2010-11-26 22:33:26','2013-03-18 06:44:54',NULL,NULL,0,NULL,NULL),(1526,'SFUSD Lowell 1526',806,'Natomas Racquet Club','2010-11-19',975,'','7:00','19:00','12','975.00','0','60991','01-11-2011',' Invoice Amt: 975','2010-11-26 22:50:52','2013-03-18 06:44:54',NULL,NULL,0,NULL,NULL),(1527,'SFUSD Hoover MS 1527',756,'','2010-11-19',375,'','14:05','17:45','4','375.00','0','609901','01-11-2011',' Invoice Amt: 375','2010-11-26 22:59:28','2013-03-18 06:44:54',NULL,NULL,0,NULL,NULL),(1528,'St Helena HS 1528',881,'G Balleyballa','2010-11-23',881.25,'','14:45','24:30','9.75','','','','',' Invoice Amt: 881.25','2010-11-26 23:12:24','2013-03-18 06:44:54',NULL,NULL,0,NULL,NULL),(1529,'SFUSD Burton HS 1529',625,'G Basketball','2010-11-23',497.5,'','14:00','19:30','5.5','497.50','0','609901','01-11-2011',' Invoice Amt: 497.5','2010-11-26 23:25:06','2013-03-18 06:44:54',NULL,NULL,0,NULL,NULL),(1530,'WCC De Anza HS 1530',861,'G Soccer Team','2010-11-23',610,'','14:00','21:00','7','610.00','0','720826','12-20-2010',' Invoice Amt: 610','2010-11-26 23:32:16','2013-03-18 06:44:54',NULL,NULL,0,NULL,NULL),(1531,'SFUSD Burton HS 1531',626,'G Balleyball','2010-11-24',525,'','14:00','20:00','6','525.00','0','609901','01-11-2011',' Invoice Amt: 525','2010-11-26 23:47:57','2013-03-18 06:44:54',NULL,NULL,0,NULL,NULL),(1532,'Quarry Lane 1532 Duplicate',736,'4th Grade Trip','2010-12-07',0,'','9:00','14:00','5','','0','','','-- Updated by patrick@simplesoftwaresf.com on 4/4/2012 at 10:47:47 PM\r\n Invoice Amt: 0','2010-11-28 16:57:00','2013-03-18 06:44:54',NULL,NULL,0,NULL,NULL),(1533,'Event West 1533',882,'City tour','2010-11-24',495,'','9:15','14:45','5.5','495.00','0','100208','2010-12-01',' Invoice Amt: 495','2010-11-28 20:52:59','2013-03-18 06:44:54',NULL,NULL,0,NULL,NULL),(1534,'SFUSD Burton HS 1534',627,'G Balleyballa','2010-11-26',375,'','11:00','14:15','4','375.00','0','609901','01-11-2011',' Invoice Amt: 375','2010-11-28 21:23:40','2013-03-18 06:44:54',NULL,NULL,0,NULL,NULL),(1535,'SFUSD Burton HS 1535',907,'G Basketball','2010-11-26',375,'','8:30','11:30','4','','','','',' Invoice Amt: 375','2010-11-28 21:35:08','2013-03-18 06:44:54',NULL,NULL,0,NULL,NULL),(1536,'St Helena HS 1536',908,'G Balleyball','2010-11-27',731.25,'','14:45','22:30','7.75','','','','',' Invoice Amt: 731.25','2010-11-28 22:19:56','2013-03-18 06:44:54',NULL,NULL,0,NULL,NULL),(1537,'WCC De Anza HS 1537',892,'G Basketball','2010-11-29',497.5,'','14.00','19.50','5.5','497.50','0','720826','12-20-2010',' Invoice Amt: 497.5','2010-11-29 23:19:01','2013-03-18 06:44:54',NULL,NULL,0,NULL,NULL),(1538,'WCC De Anza HS 1538',864,'Boys Soccer Team','2010-11-29',609,'','16:30','22:30','6','609.00','0','720826','12-20-2010',' Invoice Amt: 609','2010-11-29 23:33:50','2013-03-18 06:44:54',NULL,NULL,0,NULL,NULL),(1539,'Quarry Lane 1539',884,'Sports to Moraga Job 884','2010-12-01',450,'','14:30','18:15','4','450.00','0','23027','01-13-2011',' Invoice Amt: 450','2010-12-06 09:39:01','2013-03-18 06:44:54',NULL,NULL,0,NULL,NULL),(1540,'Quarry Lane 1540',885,'G Basketball','2010-12-02',450,'','15:45','19:30','4','450.00','0','23027','01-13-2011',' Invoice Amt: 450','2010-12-06 09:50:40','2013-03-18 06:44:54',NULL,NULL,0,NULL,NULL),(1541,'Quarry Lane 1541',883,'Basketball game','2010-11-30',450,'','16:45','19:45','4','450.00','0','23027','01-13-2011',' Invoice Amt: 450','2010-12-06 09:55:13','2013-03-18 06:44:54',NULL,NULL,0,NULL,NULL),(1542,'SFUSD 1542',680,'SFUSD One Way xfer','2010-12-03',325,'','13:45','15:45','x','325.00','0','609901','01-11-2011',' Invoice Amt: 325','2010-12-06 09:57:59','2013-03-18 06:44:54',NULL,NULL,0,NULL,NULL),(1543,'De Anza 1543',867,'Boys Soccer Team','2010-12-04',670,'','10:00','16:00','6','','','','',' Invoice Amt: 670','2010-12-06 10:00:03','2013-03-18 06:44:54',NULL,NULL,0,NULL,NULL),(1544,'SFUSD Burton HS 1544',628,'G Basketball','2010-11-29',535,'','14:30','20:30','6','535.00','0','609901','01-11-2011',' Invoice Amt: 535','2010-12-07 20:32:58','2013-03-18 06:44:54',NULL,NULL,0,NULL,NULL),(1545,'Eriton 1545',915,'WO 93663','2010-12-03',575,'','17:00','2:30','9.5','575.00','0','1143','2010-12-06',' Invoice Amt: 575','2010-12-09 00:00:24','2013-03-18 06:44:54',NULL,NULL,0,NULL,NULL),(1546,'WCC De Anza HS 1546',893,'G Basketball','2010-11-30',497.5,'','14:00','21.30','5.5','','','','',' Invoice Amt: 497.5','2010-12-10 14:47:07','2013-03-18 06:44:54',NULL,NULL,0,NULL,NULL),(1547,'SFUSD Lilienthasl 1547',807,'Field Trip','2010-12-02',450,'','8:30','15:30','7','450.00','0','1260','01-31-11',' Invoice Amt: 450','2010-12-10 15:36:20','2013-03-18 06:44:54',NULL,NULL,0,NULL,NULL),(1548,'SFUSD Lilienthasl 1548',808,'Field Trip','2010-12-02',450,'','8:30','15:30','7','450.00','0','1260','1-31-11',' Invoice Amt: 450','2010-12-10 16:05:13','2013-03-18 06:44:54',NULL,NULL,0,NULL,NULL),(1549,'SFUSD Hoover MS 1549',757,'G Basketball','2010-12-01',375,'','14:05','17:45','4','375.00','0','60901','01-11-2011',' Invoice Amt: 375','2010-12-10 16:17:31','2013-03-18 06:44:54',NULL,NULL,0,NULL,NULL),(1550,'SFUSD Oconnell HS 1550',659,'Wrestling','2010-12-03',650,'','6:00','19:00','2 Transfer','650.00','0','609901','01-11-2011',' Invoice Amt: 650','2010-12-10 20:07:17','2013-03-18 06:44:54',NULL,NULL,0,NULL,NULL),(1551,'SFUSD Academic of Art 1551',838,'','2010-12-06',350,'','15:15','18:30','4','350.00','0','609259','01-13-2011',' Invoice Amt: 350','2010-12-10 20:22:23','2013-03-18 06:44:54',NULL,NULL,0,NULL,NULL),(1552,'SFUSD Willie Brown 1552',845,'Soccer game','2010-12-07',375,'','14:00','17:45','','375.00','0','609901','01-11-2011',' Invoice Amt: 375','2010-12-10 20:35:36','2013-03-18 06:44:54',NULL,NULL,0,NULL,NULL),(1553,'SFUSD Lilienthasl 1553',811,'Field Trip','2010-12-07',900,'','8:30','15:30','7','900.00','0','1260','01-31-11',' Invoice Amt: 900','2010-12-10 20:42:52','2013-03-18 06:44:54',NULL,NULL,0,NULL,NULL),(1554,'SFUSD Lilienthasl 1554',909,'','2010-12-07',450,'','8:30','15:30','7','','','','',' Invoice Amt: 450','2010-12-10 20:53:39','2013-03-18 06:44:54',NULL,NULL,0,NULL,NULL),(1555,'SFUSD El Dorado 1555',840,'1bus 27 passenger 1 bus 37passenger. This job has .75 hrs OT','2010-12-08',775,'','9:15','14:00','4.75','775.00','0','609923','01-12-2011','amount different from quote due to .75 hrs of OT  Invoice Amt: 775','2010-12-10 20:59:38','2013-03-18 06:44:54',NULL,NULL,0,NULL,NULL),(1556,'SFUSD Burton HS 1556',629,'G Basketball','2010-12-08',450,'','15:30','20:30','5','450.00','0','609901','01-11-2011',' Invoice Amt: 450','2010-12-10 21:13:04','2013-03-18 06:44:54',NULL,NULL,0,NULL,NULL),(1557,'Presidio Josh 1557',834,'1 bus 55passengers','2010-12-09',625,'','9:00','14:30','5.5','625.00','0','077737','01-20-2011',' Invoice Amt: 625','2010-12-10 21:20:04','2013-03-18 06:44:54',NULL,NULL,0,NULL,NULL),(1558,'SFUSD Galileo HS 1558',690,'Boys Basketball Team','2010-12-08',482.5,'','16.75','22:00','5.25','482.50','0','609901','01-11-2011',' Invoice Amt: 482.5','2010-12-10 21:29:22','2013-03-18 06:44:54',NULL,NULL,0,NULL,NULL),(1559,'SFUSD Washington HS 1559',691,'Boys Basketball Team','2010-12-09',575.5,'','15:30','22:00','6.5','575.50','0','509901','01-11-2011',' Invoice Amt: 575.5','2010-12-10 21:50:17','2013-03-18 06:44:54',NULL,NULL,0,NULL,NULL),(1560,'SFUSD Lincoln Hs 1560',689,'Boys Basketball Team','2010-12-09',550,'','17:00','23:00','6','550.00','0','609901','01-11-2011',' Invoice Amt: 550','2010-12-10 22:00:37','2013-03-18 06:44:54',NULL,NULL,0,NULL,NULL),(1561,'WCC Richmond HS 1561',875,'Field Trip','2010-12-10',1757.5,'','8:00','17:00','9','1757.50','0','433794','01-12-2011',' Invoice Amt: 1757.5','2010-12-10 22:16:07','2013-03-18 06:44:54',NULL,NULL,0,NULL,NULL),(1562,'WCC De Anza HS 1562',865,'Boys Soccer Team','2010-12-01',740,'','15:00','21:00','6','','','','',' Invoice Amt: 740','2010-12-10 22:32:25','2013-03-18 06:44:54',NULL,NULL,0,NULL,NULL),(1563,'WCC De Anza HS 1563',866,'Boys Soccer Team','2010-12-02',645,'','1700','22:00','5','','','','',' Invoice Amt: 645','2010-12-10 22:50:57','2013-03-18 06:44:54',NULL,NULL,0,NULL,NULL),(1564,'Eriton Invoice 1564 and 1545 has been paid with the same check',916,'','2010-12-05',500,'','9:00','1700','8','500.00','0','1143','12-06-10',' Invoice Amt: 500','2010-12-10 23:07:25','2013-03-18 06:44:54',NULL,NULL,0,NULL,NULL),(1565,'SFUSD Marshall 1565',699,'G Basketball','2011-01-31',375,'','16:00','19:45','4','375','0','613138','02-17-11','I email Jan 31 2011 Invoice Amt: 375','2010-12-12 11:54:37','2013-03-18 06:44:54',NULL,NULL,0,NULL,NULL),(1566,'Quarry Lane Sport 1566',919,'','2010-12-14',450,'','15:00','18:00','4','450.00','0','23027','01-13-2011',' Invoice Amt: 450','2010-12-14 10:35:54','2013-03-18 06:44:54',NULL,NULL,0,NULL,NULL),(1567,'Quarry Lane Sport 1567',920,'','2010-12-16',450,'','15:50','19:00','4','','','','',' Invoice Amt: 450','2010-12-14 10:40:59','2013-03-18 06:44:54',NULL,NULL,0,NULL,NULL),(1568,'WCC Richmond HS 1568',914,'PAID','2010-12-13',1235,'','8:30','15:30','7','1235.00','0','935653','12-28-2010',' Invoice Amt: 1235','2010-12-15 00:23:11','2013-03-18 06:44:54',NULL,NULL,0,NULL,NULL),(1569,'WCC De Anza HS1569',868,'Boys Soccer Team','2010-12-14',575,'','16:00','21:00','5','','','','',' Invoice Amt: 575','2010-12-15 00:32:02','2013-03-18 06:44:54',NULL,NULL,0,NULL,NULL),(1570,'SFUSD Willie Brown 1570 Void ',846,'G Soccer game Void Duplicate with 1575','2010-12-14',375,'','14:00','17:45','4','375.00','0','609901','01-11-2011','I did  create 2 invoices 1 Dec 16 and another Dec 19 2010 Invoice Amt: 375','2010-12-16 21:07:59','2013-03-18 06:44:54',NULL,NULL,0,NULL,NULL),(1571,'WCC De Anza HS 1571',876,'Boys Basketball Team','2010-12-11',535,'','12:00','18:00','6','','','','',' Invoice Amt: 535','2010-12-18 13:00:59','2013-03-18 06:44:54',NULL,NULL,0,NULL,NULL),(1572,'SFUSD Lincoln Hs 1572',692,'Boys Basketball Team','2010-12-10',478.75,'','16:45','22:00','5.25','478.75','0','613137','02-17-11',' Invoice Amt: 478.75','2010-12-19 15:06:01','2013-03-18 06:44:54',NULL,NULL,0,NULL,NULL),(1573,'SFUSD Washington HS 1573',694,'Boys Basketball Team','2010-12-10',572.5,'','16:30','23:00','6.5','572.50','0','613137','02-17-11',' Invoice Amt: 572.5','2010-12-19 15:18:59','2013-03-18 06:44:54',NULL,NULL,0,NULL,NULL),(1574,'SFUSD Galileo HS 1574',693,'Boys Basketball Team','2010-12-10',516.25,'','14:45','20:30','5.75','516.25','0','613137','02-17-11',' Invoice Amt: 516.25','2010-12-19 15:32:54','2013-03-18 06:44:54',NULL,NULL,0,NULL,NULL),(1575,'SFUSD Willie Brown 1575',846,'Soccer game','2010-12-14',375,'','14:00','17:45','4','375.00','0','609901','',' Invoice Amt: 375','2010-12-19 15:37:34','2013-03-18 06:44:54',NULL,NULL,0,NULL,NULL),(1576,'SFUSD James Denman 1576',847,'Soccer game','2010-12-15',375,'','13:45','17:45','4','375.00','0','609901','01-11-2011',' Invoice Amt: 375','2010-12-19 16:39:41','2013-03-18 06:44:54',NULL,NULL,0,NULL,NULL),(1577,'SFUSD O 1577',661,'Wrestling','2010-12-17',1000,'','8:00','20:30','12.5','1000.00','0','609901','01-11-2011',' Invoice Amt: 1000','2010-12-19 16:48:25','2013-03-18 06:44:54',NULL,NULL,0,NULL,NULL),(1578,'SFUSD Visitation HS 1578       ',848,'Soccer game','2010-12-16',375,'','14:15','17:30','4','375.00','0','609901','01-11-2011',' Invoice Amt: 375','2010-12-19 17:17:37','2013-03-18 06:44:54',NULL,NULL,0,NULL,NULL),(1579,'WCC De Anza HS 1579',877,'Boys Basketball Team','2010-12-15',535,'','16:00','22:00','6','','','','',' Invoice Amt: 535','2010-12-19 17:25:22','2013-03-18 06:44:54',NULL,NULL,0,NULL,NULL),(1580,'WCC De Anza HS 1580',878,'Boys Basketball Team','2010-12-18',516.25,'','16:00','21:45','5.75','','','','',' Invoice Amt: 516.25','2010-12-19 17:34:41','2013-03-18 06:44:54',NULL,NULL,0,NULL,NULL),(1581,'Liz Earth Team 1581',930,'Field Trip','2010-12-17',700,'','6:30','15:45','9.25','','','','',' Invoice Amt: 700','2010-12-19 20:05:46','2013-03-18 06:44:54',NULL,NULL,0,NULL,NULL),(1582,'SFUSD Lincoln Hs 1582',681,'Wrestling','2010-12-20',325,'','6:15','One Way Transfer','','325.00','0','613137','0217-11',' Invoice Amt: 325','2010-12-26 01:22:17','2013-03-18 06:44:54',NULL,NULL,0,NULL,NULL),(1583,'SFUSD Galileo HS 1583',687,'one way transfer','2010-12-21',325,'','6:30','','','325.00','0','613137','02-17-11',' Invoice Amt: 325','2010-12-28 21:43:20','2013-03-18 06:44:54',NULL,NULL,0,NULL,NULL),(1584,'SFUSD Galileo HS 1584',684,'ONE WAY','2010-21-20',325,'','21:00','','','325.00','0','613137','02-17-11',' Invoice Amt: 325','2010-12-28 22:19:47','2013-03-18 06:44:54',NULL,NULL,0,NULL,NULL),(1585,'WCC DE ANZA 1585',823,'','2010-12-22',535,'','14:00','20:00','','','','','',' Invoice Amt: 535','2010-12-28 22:24:42','2013-03-18 06:44:54',NULL,NULL,0,NULL,NULL),(1586,'WCC DE ANZA 1586',879,'BOYS BASKETBALL','2010-12-27',535,'','14:00','20:00','','','535.00','','',' Invoice Amt: 535','2010-12-28 22:43:55','2013-03-18 06:44:54',NULL,NULL,0,NULL,NULL),(1587,'SFUSD LINCOLN 1587',682,'ONE WAY ','2010-12-20',325,'','16:00','','','325.00','0','613137','02-17-11',' Invoice Amt: 325','2010-12-28 23:00:02','2013-03-18 06:44:54',NULL,NULL,0,NULL,NULL),(1588,'SFUSD Lincoln Hs 1588',685,'ONEWAY TRANSFER','2010-12-21',325,'','06:15','','','325.00','0','613137','02-17-11',' Invoice Amt: 325','2010-12-28 23:07:44','2013-03-18 06:44:54',NULL,NULL,0,NULL,NULL),(1589,'SFUSD JUNE JORDAN 1589',888,'G BASKET','2010-12-27',535,'','13:00','19:00','6.0','535.00','0','613137','02-17-11','.5 OT Invoice Amt: 535','2010-12-28 23:15:34','2013-03-18 06:44:54',NULL,NULL,0,NULL,NULL),(1590,'SFUSD Lincoln Hs 1590',686,'','2010-12-21',325,'','16:00','','','325.00','0','613137','02-17-11',' Invoice Amt: 325','2011-01-02 23:08:26','2013-03-18 06:44:54',NULL,NULL,0,NULL,NULL),(1591,'SFUSD June Jordan 1591',889,'','2010-12-28',525,'','10:00','16:00','6','525.00','0','613137','02-17-11',' Invoice Amt: 525','2011-01-02 23:33:04','2013-03-18 06:44:54',NULL,NULL,0,NULL,NULL),(1592,'SFUSD June Jordan 1592',890,'','2010-12-29',422.5,'','9:30','14:00','4.5','422.50','0','613137','02-17-11',' Invoice Amt: 422.5','2011-01-03 00:00:42','2013-03-18 06:44:54',NULL,NULL,0,NULL,NULL),(1593,'SFUSD Marshall 1593',925,'girls basketball','2010-12-29',375,'','17:30','21:30','4','375.00','0','613137','02-17-11',' Invoice Amt: 375','2011-01-03 00:19:01','2013-03-18 06:44:54',NULL,NULL,0,NULL,NULL),(1594,'SFUSD Burtonl 1594',632,'','2010-12-30',375,'','10:00','14:00','','375.00','0','613137','02-17-11',' Invoice Amt: 375','2011-01-03 00:25:20','2013-03-18 06:44:54',NULL,NULL,0,NULL,NULL),(1595,'SFUSD Burton HS 1595',638,'girls basketball','2010-12-28',450,'','11:30','16:30','5','450.00','0','613137','02-17-11',' Invoice Amt: 450','2011-01-03 00:45:05','2013-03-18 06:44:54',NULL,NULL,0,NULL,NULL),(1596,'SFUSD Marshall 1596',926,'girls basketball','2010-12-30',412.5,'','16:30','21:00','4.5','412.50','0','613137','02-17-11',' Invoice Amt: 412.5','2011-01-03 00:50:42','2013-03-18 06:44:54',NULL,NULL,0,NULL,NULL),(1597,'Quarry Lane Shari 1597',733,'field trip','2011-01-12',720,'','08:30','14:30','6.0','','720.00','','','invoice emailed to Shari on 1-4-11 Invoice Amt: 720','2011-01-04 11:15:44','2013-03-18 06:44:54',NULL,NULL,0,NULL,NULL),(1598,'Quarry Lane 1598',715,'1st grade Lawrence Hall','2011-01-13',970,'','08:30','15:00','6.5','970.00','0','23024','01-13-2011','emailed to Gabby on 1-12-11 Invoice Amt: 970','2011-01-05 18:57:15','2013-03-18 06:44:54',NULL,NULL,0,NULL,NULL),(1599,'Quarry Lane 1599',927,'Pier 39 Field trip     JOB 927','01-19-2011',650,'','08:30','15:30','','650.00','0','23023','01-13-2011','EMAILED ON 1-12-11 TO GABBY Invoice Amt: 650','2011-01-05 19:10:00','2013-03-18 06:44:54',NULL,NULL,0,NULL,NULL),(1600,'WCC DE ANZA HS 1600',894,'changed to 37 passanger bus','2011-01-05',875,'','14:30','23:30','9.0','','','','','THEY REQUESTED A BIGGER BUS.CHARGE FOR 37 PASSANGER   Invoice emailed on 1-14-2011 Invoice Amt: 875','2011-01-06 10:16:00','2013-03-18 06:44:54',NULL,NULL,0,NULL,NULL),(1601,'Laney College 1601',932,'paid with check #1120','2011-01-12',0,'','14:00','17:00','4','395.00','0','1120','01-19-2011','emailed on 1-14-11 to Louis, emailed paid  Invoice Amt: 0','2011-01-07 00:14:48','2013-03-18 06:44:54',NULL,NULL,0,NULL,NULL),(1602,'Peter Brown 1602',933,'$395 paid with check #1120 by Louis Quindlen','2011-01-13',395,'','14:00','17:00','4','395.00','0','1120','01-19-11','emailed on 1-14-11 to Louis........ Invoice Amt: 395','2011-01-07 00:25:31','2013-03-18 06:44:54',NULL,NULL,0,NULL,NULL),(1603,' Quarry Lane Field Trip 1603',741,'3rd grade field trip','01-27-2011',755,'','08:10','15:00','7','755.00','0','23025','01-13-2011',' Invoice Amt: 755','2011-01-07 09:33:10','2013-03-18 06:44:54',NULL,NULL,0,NULL,NULL),(1604,'WCC De Anza Sport 1604',880,'Sport','2011-01-04',460,'','16:30','21:30','5.0','','460.00','','','invoice sent on 1-14-2011 Invoice Amt: 460','2011-01-07 10:50:22','2013-03-18 06:44:54',NULL,NULL,0,NULL,NULL),(1605,'WCC De Anza 1605',900,'','2011-01-04',385,'','14:30','18:30','4.00','','385.00','','','invoiced emailed on 1-14-2011 Invoice Amt: 385','2011-01-07 10:55:59','2013-03-18 06:44:54',NULL,NULL,0,NULL,NULL),(1606,'SFUSD James Lick 1606',849,'','2011-01-07',450,'','14:30','17:45','4','450.00','0','613137','02-17-11','emailed to Sonya on 1-9-2011 Invoice Amt: 450','2011-01-09 11:25:42','2013-03-18 06:44:54',NULL,NULL,0,NULL,NULL),(1607,'UCSF Surgury 1607',653,'','2011-01-13',450,'','11:00','13:30','4','450.00','0','2346628','01-12-2011','old system 1363 paid  Invoice Amt: 450','2011-01-12 09:59:05','2013-03-18 06:44:54',NULL,NULL,0,NULL,NULL),(1608,' Quarry Lane Sport 1608',948,'Sport Boy Basketball','2011-01-11',450,'','16:30','20:30','4','450.00','0','23043','01-24-2011','Emailed to Phillip on 1-12-11 Invoice Amt: 450','2011-01-12 10:44:03','2013-03-18 06:44:54',NULL,NULL,0,NULL,NULL),(1609,'Quarry Lane Sport 1609',952,'Sport Boys Basketball','2011-01-14',450,'','14:30','20:00','','','450.00','','','emailed to Phillip on 1-12-11 Invoice Amt: 450','2011-01-12 11:14:25','2013-03-18 06:44:54',NULL,NULL,0,NULL,NULL),(1610,'WCC De Anza 1610',901,'soccer','01-11-2011',572.5,'','14:30','21:00','','','572.50','','','emailed to Rosa 1-14-2011 Invoice Amt: 572.5','2011-01-12 17:37:53','2013-03-18 06:44:54',NULL,NULL,0,NULL,NULL),(1611,'WCC De Anza 1611',895,'sports','01-11-2011',460,'','16:30','21:30','5','','460.00','','','emailed on 1-14-2011 Invoice Amt: 460','2011-01-12 17:48:19','2013-03-18 06:44:54',NULL,NULL,0,NULL,NULL),(1612,'Kevin Earth 1612',837,'Send by email Jan 12 2011','2011-01-11',575,'','8:00','15:00','','575.00','0','003838','01-19-2011','Send by email Jan 12 2011 Invoice Amt: 575','2011-01-12 22:50:56','2013-03-18 06:44:54',NULL,NULL,0,NULL,NULL),(1613,'SFUSD James Denman 1613',924,'Boys Soccer Send by email Jan 12 2011','2011-01-12',375,'','13:45','17:45','4','375.00','0','613137','02-17-11','Send to Sonya Jan 12 2011 by email Invoice Amt: 375','2011-01-12 22:59:06','2013-03-18 06:44:54',NULL,NULL,0,NULL,NULL),(1614,'WCC De Anza HS 1614',871,'Boys Soccer  Send Jan 13 email ','2011-01-13',625,'','14:30','21:00','','','625.00','','','Send by email Invoice Amt: 625','2011-01-13 21:43:26','2013-03-18 06:44:54',NULL,NULL,0,NULL,NULL),(1615,'SFUSD ISA 1615',695,'G Basketball Send by email Jan 13 2011','2011-01-13-',450,'','16:30','19:45','','450.00','0','613137','02-17-11','Send by email on Jan 13 2011 Invoice Amt: 450','2011-01-13 22:01:40','2013-03-18 06:44:54',NULL,NULL,0,NULL,NULL),(1616,'Kevin Earth 1616',937,'Send by email Jan 17 2011','2011-01-14',450,'','10:15','15:15','5','450.00','0','003838','01-19-2011',' Invoice Amt: 450','2011-01-16 23:54:41','2013-03-18 06:44:54',NULL,NULL,0,NULL,NULL),(1617,'aptos 1617 ',941,'volleyball','01-18-2011',375,'','14:35','17:15','','375.00','0','613138','02-17-11','emailed to Sonya 1-19-2011 Invoice Amt: 375','2011-01-19 08:40:03','2013-03-18 06:44:54',NULL,NULL,0,NULL,NULL),(1618,'El Cerrito HS 1618',934,'','02-15-2011',513.75,'','12:15','17:00','','','','','','emailed to Chris Merrida on 1-19-2011 per his request  Invoice Amt: 513.75','2011-01-19 13:06:59','2013-03-18 06:44:54',NULL,NULL,0,NULL,NULL),(1619,'sfusd Balboa HS 1619',949,'sports','01-18-2011',560,'','15:00','20:30','5.5','','560.00','','','emailed to Sonya 1-19-11 Invoice Amt: 560','2011-01-19 13:33:26','2013-03-18 06:44:54',NULL,NULL,0,NULL,NULL),(1620,'SFUSD SONYA 1620',697,'','01-18-2011',350,'','','','','350.00','0','613138','02-17-11','Job sent to Frances, but the bus was late, giving a $25 discount for our mistake. Invoice Amt: 350','2011-01-19 13:38:53','2013-03-18 06:44:54',NULL,NULL,0,NULL,NULL),(1621,'WCC De Anza 1621',896,'','01-18-2011',460,'','16:30','21:30','5','','460.00','','','emailed to Rosa on 1-19-2011 Invoice Amt: 460','2011-01-19 13:49:37','2013-03-18 06:44:54',NULL,NULL,0,NULL,NULL),(1622,'WCC Pinole HS Brian McDonnell 1622',936,'field trip to Martinez court house','01-19-2011',691.25,'','','','','','691.25','','','Rick said that this job ended at 2:30.....so his bill will be 5.5 hrs....emailed to Rosa 1-20-11 Invoice Amt: 691.25','2011-01-20 12:55:27','2013-03-18 06:44:54',NULL,NULL,0,NULL,NULL),(1623,'Quarry Lane 1623',972,'sports','01-19-2011',450,'','16:00','20:00','4','450.00','0','23043','01-24-2011','emailed to Phillip on 1-20-11 Invoice Amt: 450','2011-01-20 13:31:43','2013-03-18 06:44:54',NULL,NULL,0,NULL,NULL),(1624,'St Helena 1624',969,'Fort Bragg','01-19-2011',1125,'','','','11.5','1125','0','728742','','emailed to Eve Hardell on 1-20-11 Invoice Amt: 1125','2011-01-20 15:22:40','2013-03-18 06:44:54',NULL,NULL,0,NULL,NULL),(1625,'WCC De Anza HS 1625',976,'Boys Soccer Team','2011-01-18',460,'','14:00','20:00','','','','','','sent to Rosa 1-19-11 Invoice Amt: 460','2011-01-20 22:17:50','2013-03-18 06:44:54',NULL,NULL,0,NULL,NULL),(1626,'THIS IS DUPLICATE INVOICE 1626',654,'THIS INVOICE IS FOR 1364','',0,'','','','','450.00','0','2346629','12-3-2010',' Invoice Amt: 0','2011-01-21 12:31:21','2013-03-18 06:44:54',NULL,NULL,0,NULL,NULL),(1627,'SFUSD Galileo HS 1627',688,'Wrestling','2010-12-21',325,'','14:00','','','325.00','0','613137','02-17-11',' Invoice Amt: 325','2011-01-22 15:43:18','2013-03-18 06:44:54',NULL,NULL,0,NULL,NULL),(1628,'SFUSD Galileo HS 1628',683,'Wrestling','2010-12-20',325,'','6:30','','','325.00','0','613137','02-17-11',' Invoice Amt: 325','2011-01-22 16:00:11','2013-03-18 06:44:54',NULL,NULL,0,NULL,NULL),(1629,'SFUSD Marshall 1629',696,'G Basketball','2011-01-13',375,'','16:00','19:45','','375.00','0','613137','02-17-11','Send by email Jan 23 2011 Invoice Amt: 375','2011-01-22 22:07:16','2013-03-18 06:44:54',NULL,NULL,0,NULL,NULL),(1630,'SFUSD Aptos MS 1630',940,'Volleyball','2011-01-14',375,'','14:45','17:45','4','375.00','0','613138','02-17-11','Send by mail Jan 23 2011 Invoice Amt: 375','2011-01-22 22:14:26','2013-03-18 06:44:54',NULL,NULL,0,NULL,NULL),(1631,'Gateway HS 1631',970,'San Anselmo','2011-01-21',422.5,'','14:30','19:00','4.5','422.50','0','7754','02-10-11','send by mail Jan 23 2011 Invoice Amt: 422.5','2011-01-22 23:25:38','2013-03-18 06:44:54',NULL,NULL,0,NULL,NULL),(1632,'Kevin Earth Team 1632',935,'Pinole Valley HS','2011-01-20',575,'','08:15','15:00','7','575.00','0','003843','01-26-11','Send by mail Jan 23 2011 Invoice Amt: 575','2011-01-22 23:33:30','2013-03-18 06:44:54',NULL,NULL,0,NULL,NULL),(1633,'De Anza HS 1633',897,'Boys Basketball','2011-01-21',460,'','16:30','21:30','6','','','','','send by mail Jan 23 2011 Invoice Amt: 460','2011-01-22 23:37:59','2013-03-18 06:44:54',NULL,NULL,0,NULL,NULL),(1634,'De Anza G Volleyball 1634',768,'El Cerrito HS Duplicate invoice 1462','2010-10-19',460,'','15:00','19:30','4.5','paid','','','',' Invoice Amt: 460','2011-01-24 09:42:36','2013-03-18 06:44:54',NULL,NULL,0,NULL,NULL),(1635,'SFUSD Marshall 1635',698,'G Basketball','2011-01-24',375,'','16:00','19:45','4','375.00','0','613138','02-17-11','Email Jan 25 2011 Juana Invoice Amt: 375','2011-01-25 11:30:28','2013-03-18 06:44:54',NULL,NULL,0,NULL,NULL),(1636,'WCC Richmond HS 1636',923,'Field Trip, 2buses it was order but only 1 bus was use 27 passenger','2011-01-25',610,'','9:00','16:00','7','610.00','0','434523','02-03-2011','Email Jan 25 2011 Juana Invoice Amt: 610','2011-01-25 11:40:53','2013-03-18 06:44:54',NULL,NULL,0,NULL,NULL),(1637,'WCC De Anza HS 1637',902,'G Soccer game','2011-01-25',497.5,'','15:00','20:30','5.5','','','','','emailed 1-25-11 by Juana Invoice Amt: 497.5','2011-01-25 22:59:34','2013-03-18 06:44:54',NULL,NULL,0,NULL,NULL),(1638,'WCC De Anza HS 1638',825,'G Basketball','2011-01-25',385,'','16:00','20:00','4','','','','','emailed 1-25-11 by Juana Invoice Amt: 385','2011-01-25 23:03:59','2013-03-18 06:44:54',NULL,NULL,0,NULL,NULL),(1639,'SFUSD Roosevelt 1639',981,'Soccer game','2011-01-25',375,'','14:15','17:30','4','375.00','0','613138','02-17-11','emailed 1-25-11 by Juana Invoice Amt: 375','2011-01-25 23:13:53','2013-03-18 06:44:54',NULL,NULL,0,NULL,NULL),(1640,'WCC Pinole HS  1640',929,'field trip','01-26-2011',691.25,'','9:00','15:15','','','691.25','','','emailed to Rosa 1-27-11 Invoice Amt: 691.25','2011-01-27 16:16:45','2013-03-18 06:44:54',NULL,NULL,0,NULL,NULL),(1641,'SFUSD Teresa 1641',968,'Field trip','01-27-2011',410,'','8:15','13:30','5.25','','410.00','','','this price was agreed with Juana...emailed to Teresa on 1-28-11 Invoice Amt: 410','2011-01-28 08:59:42','2013-03-18 06:44:54',NULL,NULL,0,NULL,NULL),(1642,'SFUSD SONYA 1642',982,'SPORTS Soccer Team','01-27-2011',375,'','14:15','17:30','','','375.00','','','emailed to Sonya 1-28-11  Invoice Amt: 375','2011-01-28 11:31:43','2013-03-18 06:44:54',NULL,NULL,0,NULL,NULL),(1643,'SFUSD Sonya sport 1643',852,'sports volley ball','01-27-2011',375,'','14:30','17:30','','375.00','0','613138','02-17-11','emailed to Sonya 1-28-11 Invoice Amt: 375','2011-01-28 12:06:18','2013-03-18 06:44:54',NULL,NULL,0,NULL,NULL),(1644,'SFUSD Sonya 1644',943,'volleyball','01-27-2011',375,'','14:45','17:30','','375.00','0','613138','02-17-11','emailed to Sonya 1-28-11 Invoice Amt: 375','2011-01-28 12:13:40','2013-03-18 06:44:54',NULL,NULL,0,NULL,NULL),(1645,'WCC DeAnza 1645',872,' Boys soccer','01-27-2011',625,'','14:30','21:00','','','625.00','','','emailed to Rosa 1-28-2011 Invoice Amt: 625','2011-01-28 12:56:16','2013-03-18 06:44:54',NULL,NULL,0,NULL,NULL),(1646,'Eriton 1646',984,'One way transfer','2011-01-29',250,'','22:00','','','250.00','0','1207','','send by email Jan 30 2011 Juana Invoice Amt: 250','2011-01-30 22:44:31','2013-03-18 06:44:54',NULL,NULL,0,NULL,NULL),(1647,'Quarry Lane 1st grade 1647',730,'1st grade field trip ','02-02-2011',670,'','08:00','14:00','','670.00','0','23124','02-23-11',' Invoice Amt: 670','2011-02-02 13:27:14','2013-03-18 06:44:54',NULL,NULL,0,NULL,NULL),(1648,'Quarry Lane field trip 1648',921,'','02-02-2011',550,'','08:30','11:30','','550.00','0','23122','02-23-11',' Invoice Amt: 550','2011-02-02 13:31:56','2013-03-18 06:44:54',NULL,NULL,0,NULL,NULL),(1649,'Quarry Lane 1649',650,'2nd grade field trip','2-02-2011',725,'','10:15','14:00','','725.00','0','23123','02-23-11',' Invoice Amt: 725','2011-02-02 13:36:08','2013-03-18 06:44:54',NULL,NULL,0,NULL,NULL),(1650,'Quarry Lane 1650',742,'3rd grade field trip ','02-24-2011',755,'','08:10','15:00','','755.00','0','23125','02-24-11',' Invoice Amt: 755','2011-02-02 13:38:00','2013-03-18 06:44:54',NULL,NULL,0,NULL,NULL),(1651,'Gateway HS 1651',938,'Basketball game','2011-02-02',630,'','14:00','20:00','6','630.00','0','7754','02-10-10','Juana email Feb 02 2011 Invoice Amt: 630','2011-02-02 23:51:33','2013-03-18 06:44:54',NULL,NULL,0,NULL,NULL),(1652,'WCC De Anza HS 1652',903,'G Soccer game','2011-02-01',497.5,'','15:00','20:30','5.5','','','','','Juana email Feb 02 2011 Invoice Amt: 497.5','2011-02-03 00:07:40','2013-03-18 06:44:54',NULL,NULL,0,NULL,NULL),(1653,'SFUSD Martin L King 1653',990,'Volleyball','2011-02-01',375,'','14:00','17:30','','375.00','0','613138','02-17-11','Juana email Feb 02 2011 Invoice Amt: 375','2011-02-03 00:12:29','2013-03-18 06:44:54',NULL,NULL,0,NULL,NULL),(1654,'WCC De Anza HS 1654',873,'Boys Soccer Team email Feb 03','2011-02-03',535,'','15:30','20:30','5','','','','','I send to Rosa by Juana Invoice Amt: 535','2011-02-03 23:03:09','2013-03-18 06:44:54',NULL,NULL,0,NULL,NULL),(1655,'SFUSD Wallenber HS 1655',887,'G Basketball email Feb 5 2011','2011-02-04',431.25,'','14.45','19.30','4.75','431.25','0','613138','02-17-11','Juana email Feb 05 2011 Invoice Amt: 431.25','2011-02-05 22:45:00','2013-03-18 06:44:54',NULL,NULL,0,NULL,NULL),(1656,'Cecilia Zepeda 1656',1030,'Sacramento Price Revise over time','02-08-2011',400,'','08:30','14:15','5.75','400.00','0','1280','02-10-2011',' Invoice Amt: 400','2011-02-08 16:05:08','2013-03-18 06:44:54',NULL,NULL,0,NULL,NULL),(1657,'SFUSD Sonya Aptos 1657',944,'Volleyball','02-09-2011',375,'','14:45','17:15','','','375.','','',' Invoice Amt: 375','2011-02-09 11:24:09','2013-03-18 06:44:54',NULL,NULL,0,NULL,NULL),(1658,'WCC De Anza Sport 1658',904,'girl soccer','02-09-2011',487.5,'','15:30','21:00','','','487.50','','',' Invoice Amt: 487.5','2011-02-09 11:43:49','2013-03-18 06:44:54',NULL,NULL,0,NULL,NULL),(1659,'WCC De Anza Sport 1659',898,'boys basketball','02-09-2011',525,'','16:00','22:00','6','','525.00','','',' Invoice Amt: 525','2011-02-09 11:53:33','2013-03-18 06:44:54',NULL,NULL,0,NULL,NULL),(1660,'David Vielman 1660',998,'Field trip','2011-02-13',700,'','8:00','16:15','','700.00','0','','2011-02-13',' Invoice Amt: 700','2011-02-13 06:15:13','2013-03-18 06:44:54',NULL,NULL,0,NULL,NULL),(1661,'David Vielman 1661',997,'','2011-02-12',0,'','8:00','16:15','','700.00','0','','',' Invoice Amt: 0','2011-02-13 06:18:19','2013-03-18 06:44:54',NULL,NULL,0,NULL,NULL),(1662,'WCC De Anza HS 1662',874,'G Soccer','2011-02-10',497.5,'','15:15','20:30','5.25','','','','',' Invoice Amt: 497.5','2011-02-14 19:35:07','2013-03-18 06:44:54',NULL,NULL,0,NULL,NULL),(1663,'WCC Pinole HS 1663',974,'Field Trip','2011-02-10',655,'','8:30','14:30','6','','','','',' Invoice Amt: 655','2011-02-14 20:03:26','2013-03-18 06:44:54',NULL,NULL,0,NULL,NULL),(1664,'SFUSD George Peabody 1664',950,'Field Trip one Way','2011-02-10',0,'','9:30','','','','','','',' Invoice Amt: 0','2011-02-14 20:10:53','2013-03-18 06:44:54',NULL,NULL,0,NULL,NULL),(1665,'SFUSD George Peabody 1665',951,'Field Trip one Way','2011-02-11',240,'','12:30','','','','','','',' Invoice Amt: 240','2011-02-14 20:19:28','2013-03-18 06:44:54',NULL,NULL,0,NULL,NULL),(1666,'SFUSD Everett MS 1666',1031,'Volleyball','2011-02-11',375,'','14:30','16:15','4','','','','',' Invoice Amt: 375','2011-02-14 20:25:19','2013-03-18 06:44:54',NULL,NULL,0,NULL,NULL),(1667,'WCC Kennedy HS 1667',993,'Field Trip','2011-02-11',0,'','6:30','16:00','9.5','','','','',' Invoice Amt: 0','2011-02-14 20:38:57','2013-03-18 06:44:54',NULL,NULL,0,NULL,NULL),(1668,'SFUSD Martin L King 1668',1040,'Field Trip','2011-02-16',400,'','9:00','15:00','6','','','','',' Invoice Amt: 400','2011-02-14 20:47:26','2013-03-18 06:44:54',NULL,NULL,0,NULL,NULL),(1669,'WCC El Cerrito HS 1669',954,'Field Trip','2011-02-11',917.5,'','6:30','16:00','9.5','','','','',' Invoice Amt: 917.5','2011-02-14 20:57:09','2013-03-18 06:44:54',NULL,NULL,0,NULL,NULL),(1670,'SFUSD Moscone Ele',967,'Field Trip','2011-02-10',0,'','8:15','13:30','5.25','','','','',' Invoice Amt: 0','2011-02-14 21:04:38','2013-03-18 06:44:54',NULL,NULL,0,NULL,NULL),(1671,'SFMB Ludi 1671',1082,'Charter','2011-02-12',350,'','9:05','13.15','5','','','','',' Invoice Amt: 350','2011-02-14 21:17:29','2013-03-18 06:44:54',NULL,NULL,0,NULL,NULL),(1672,'Quarry Lane sport 1672',1081,'basketball','02-16-2011',450,'','15:45','19:45','4','','450.00','','','emailed to Phillip on 2-16-2011 Invoice Amt: 450','2011-02-16 10:14:07','2013-03-18 06:44:54',NULL,NULL,0,NULL,NULL),(1673,'SFUSD Sonya 1673',853,'Volleyball','02-16-2011',375,'','14:30','17:45','4','','375.00','','','emailed to Sonya 2-16-11 Invoice Amt: 375','2011-02-16 10:38:57','2013-03-18 06:44:54',NULL,NULL,0,NULL,NULL),(1674,'Kevin Earth 1674',987,'It was quote for 37passenger bus','2011-02-15',518.75,'','8:15','14:30','6.25','518.75','0','003894','02-18-11',' Invoice Amt: 518.75','2011-02-16 12:25:59','2013-03-18 06:44:54',NULL,NULL,0,NULL,NULL),(1675,'WCC Pinole 1675 ',975,'field trip ','2011-02-17',1047.5,'','07:30','15:00','','1047.50','0','435629','2011-03-09',' Invoice Amt: 1047.5','2011-02-18 12:22:54','2013-03-18 06:44:54',NULL,NULL,0,NULL,NULL),(1676,'SFUSD Teresa O Connell 1676',1075,'Field Trip Newcomer ','2011-02-17',300,'','12:30','15:30','','','300.00','','',' Invoice Amt: 300','2011-02-18 12:39:24','2013-03-18 06:44:54',NULL,NULL,0,NULL,NULL),(1677,'SFUSD Sonya MLK 1677',991,'volleyball','2011-02-17',412.5,'','14:00','18:30','4.5','','412.50','','',' Invoice Amt: 412.5','2011-02-18 12:46:20','2013-03-18 06:44:54',NULL,NULL,0,NULL,NULL),(1678,'Gateway 1678',1086,'basketball','2011-02-17',535,'','15:00','20:00','5','','535.00','','',' Invoice Amt: 535','2011-02-18 12:56:37','2013-03-18 06:44:54',NULL,NULL,0,NULL,NULL),(1679,'Eriton 1679',996,'2 buses','2011-02-16',800,'','19:00','1:00','6','800','0','1214','2011-02-24','emailed to Tony on 2-22-11 Invoice Amt: 800','2011-02-22 11:21:32','2013-03-18 06:44:54',NULL,NULL,0,NULL,NULL),(1680,'WCC De Anza HS 1680',899,'boys basketball','02-18-2011',535,'','16:00','22:00','','535.00','0','435886','2011-03-16','emailed invoice to Rosa on 2-22-11 Invoice Amt: 535','2011-02-22 11:56:32','2013-03-18 06:44:54',NULL,NULL,0,NULL,NULL),(1681,'Eriton 1681',1033,'WEDDING ','02-19-2011',300,'','12:45','16:45','4','300','0','1214','2011-02-24','emailed to Tony 2-22-11 Invoice Amt: 300','2011-02-22 12:43:39','2013-03-18 06:44:54',NULL,NULL,0,NULL,NULL),(1682,'Event west 1682 ',1079,'wedding ','02-19-2011',600,'','12:45','21:00','','600','0','100288','2011-02-23',' Invoice Amt: 600','2011-02-22 12:54:00','2013-03-18 06:44:54',NULL,NULL,0,NULL,NULL),(1683,'Quarry Lane Gabby 1683',1080,'Grade-K Field trip','03-02-2011',650,'','10:30','13:45','','','650.00','','','emailed to Gabby 2-24-11 Invoice Amt: 650','2011-02-24 15:37:14','2013-03-18 06:44:54',NULL,NULL,0,NULL,NULL),(1684,'Earth team 1684',1078,'field trip ','2011-02-22',450,'','11:30','15:00','','','450.00','','',' Invoice Amt: 450','2011-02-24 17:42:25','2013-03-18 06:44:54',NULL,NULL,0,NULL,NULL),(1685,'SFUSD Sonya 1685',702,'girls basketball','2011-02-22',375,'','16:00','19:45','','','375.00','','',' Invoice Amt: 375','2011-02-24 18:16:29','2013-03-18 06:44:54',NULL,NULL,0,NULL,NULL),(1686,'SFUSD Lowell Sonya 1686',1035,'baseball.....this job went into overtime','2011-02-23',562.5,'','13:15','18:45','','','562.50','','','went over 1.25 OT Invoice Amt: 562.5','2011-02-24 18:30:13','2013-03-18 06:44:54',NULL,NULL,0,NULL,NULL),(1687,'SFUSD Lilienthal Sonya 1687',1092,'volleyball','2011-02-23',375,'','14:15','17:30','4','','375.00','','',' Invoice Amt: 375','2011-02-24 18:36:58','2013-03-18 06:44:54',NULL,NULL,0,NULL,NULL),(1688,'SFUSD MLK Sonya 1688',992,'volleyball','2011-02-24',375,'','14:00','17:30','','','375.00','','',' Invoice Amt: 375','2011-02-24 18:42:49','2013-03-18 06:44:54',NULL,NULL,0,NULL,NULL),(1689,'SFUSD Aptos Sonya 1689',945,'volleyball ','2011-02-24',375,'','14:45','17:30','4','','375.00','','',' Invoice Amt: 375','2011-02-24 18:49:11','2013-03-18 06:44:54',NULL,NULL,0,NULL,NULL),(1690,'SFUSD Marshall 1690',1077,'Baseball','2011-02-26',375,'','13:30','17:30','4','','','','','Email March 1st to Sonya Invoice Amt: 375','2011-03-01 23:06:00','2013-03-18 06:44:54',NULL,NULL,0,NULL,NULL),(1691,'SFUSD Marshall 1691',1107,'Baseball','2011-03-01',450,'','13:30','18:30','5','','','','',' Invoice Amt: 450','2011-03-01 23:25:59','2013-03-18 06:44:54',NULL,NULL,0,NULL,NULL),(1692,'WCC De Anza HS REVISE INVOICE 1692',994,'','2011-03-11',2975,'','16:00','18:00 March 13 2011','From March 11 to 13 2011','','2975.00','','','Is waiting for Itinerary 3-1 send by fax to Jan Bridge Invoice Amt: 2975','2011-03-01 23:56:33','2013-03-18 06:44:54',NULL,NULL,0,NULL,NULL),(1693,'SFUSD Moscone 1693',965,'field trip','03-03-2011',450,'','08:15','13:30','5.25','','450.00','','',' Invoice Amt: 450','2011-03-06 10:09:04','2013-03-18 06:44:54',NULL,NULL,0,NULL,NULL),(1694,'Earth Teat 1694',986,'','03-03-2011',535,'','10:15','15:15','5','','535.00','','','450 + 85 Invoice Amt: 535','2011-03-06 10:16:25','2013-03-18 06:44:54',NULL,NULL,0,NULL,NULL),(1695,'WCC Juan Crespi 1695',1121,'55 pass 1000+ 37 740.00 27 pass 610.00=2350.00','03-04-2011',2350,'','08:00','15:00','7','2350.00','0','435886','2011-03-16',' Invoice Amt: 2350','2011-03-06 11:04:48','2013-03-18 06:44:54',NULL,NULL,0,NULL,NULL),(1696,'Compass 1696',1120,'','03-04-2011',577.5,'','09:00','14:30','5.5','','577.50','','','called compass and accounting said to fax invoice to 650-246-2778 Invoice Amt: 577.5','2011-03-06 14:05:40','2013-03-18 06:44:54',NULL,NULL,0,NULL,NULL),(1697,'Tony Diestro 1697',1099,'','03-05-2011',300,'','18:45','22:45','4','','300.00','','',' Invoice Amt: 300','2011-03-07 16:02:48','2013-03-18 06:44:54',NULL,NULL,0,NULL,NULL),(1698,'Wallenber HS1698 ',1038,'Softball CANCEL ON SPOT','2011-03-08',375,'','14:15','','4','','','','','Email March 09 2011 Invoice Amt: 375','2011-03-08 10:11:02','2013-03-18 06:44:54',NULL,NULL,0,NULL,NULL),(1699,'Bonjour Transportation 1699',999,'','2011-03-06',400,'','9:00','13:00','4','','','','',' Invoice Amt: 400','2011-03-08 23:08:58','2013-03-18 06:44:54',NULL,NULL,0,NULL,NULL),(1700,'De Anza 1700',1014,'','2011-03-07',712.5,'','13:00','19:30','6.5','712.5','0','00436436','2011-03-30','Email March 9 2011 Invoice Amt: 712.5','2011-03-08 23:20:05','2013-03-18 06:44:54',NULL,NULL,0,NULL,NULL),(1701,'Burton HS 1701',1057,'G Soccer','2011-03-08',375,'','14:00','17:45','4','','','','','Email March 09 2011 Invoice Amt: 375','2011-03-08 23:49:49','2013-03-18 06:44:54',NULL,NULL,0,NULL,NULL),(1702,'Marshall HS 1702',1108,'Baseball CANCEL SPOT BY SCHOOL','2011-03-08',375,'','13:30','','4','','','','','Email March 09 2011 Invoice Amt: 375','2011-03-08 23:55:02','2013-03-18 06:44:54',NULL,NULL,0,NULL,NULL),(1703,'Verde Elementary School 1703',1074,'Field trip 1bus 59 pax 1bus 37pax','2011-03-08',1730,'','8:30','15:50','7.5','','','','','Email March 9 2011 Invoice Amt: 1730','2011-03-09 00:02:57','2013-03-18 06:44:54',NULL,NULL,0,NULL,NULL),(1704,'Quarry Lane 1704',1084,'Basketball','2011-03-08',450,'','15:30','19:30','4','','','','','Email March 09 2011 Invoice Amt: 450','2011-03-09 00:12:26','2013-03-18 06:44:54',NULL,NULL,0,NULL,NULL),(1705,'Bio-Link City College San Francisco ',1129,'Summer Fellows Forum 2011','2011-06-08',895,'','13:00','19:00','6','','895.00','','',' Invoice Amt: 895','2011-03-09 19:16:54','2013-03-18 06:44:54',NULL,NULL,0,NULL,NULL),(1706,'Quarry Lane Sport 1706',1085,'Basketball','2011-03-09',450,'','15:45','21:00','4','','','','','Email March 09 2011 Invoice Amt: 450','2011-03-09 21:54:59','2013-03-18 06:44:54',NULL,NULL,0,NULL,NULL),(1707,'Burton HS 1707',1051,'Baseball CANCEL SPOT BY SCHOOL','2011-03-09',375,'','14:00','Cancel Spot by school','','','','','','Email March 9 2011 Invoice Amt: 375','2011-03-09 22:01:59','2013-03-18 06:44:54',NULL,NULL,0,NULL,NULL),(1708,'Flynn Elemntary 1708',1109,'Viridiana Sanchez','2011-03-09',350,'','9:30','13:30','','','','','','Email March 09 to Nicole Presidio Invoice Amt: 350','2011-03-09 22:10:45','2013-03-18 06:44:54',NULL,NULL,0,NULL,NULL),(1709,'SFUSD Moscone Elementary 1709',966,'Field trip','2011-03-10',450,'','8:15','13:30','5','','','','',' Invoice Amt: 450','2011-03-14 00:23:20','2013-03-18 06:44:54',NULL,NULL,0,NULL,NULL),(1710,'ER Taylor 1710',1122,'Field trip','2011-03-10',0,'','9:30','14:30','5','','','','',' Invoice Amt: 0','2011-03-14 00:30:19','2013-03-18 06:44:54',NULL,NULL,0,NULL,NULL),(1711,'SFUSD OConnell 1711',1093,'Boys Volleyball','2011-03-11',0,'','15:30','20:00','4.5','','','','',' Invoice Amt: 0','2011-03-14 00:43:33','2013-03-18 06:44:54',NULL,NULL,0,NULL,NULL),(1712,'SFUSD Clarendon elem 1712',1098,'Field trip','2011-30-10',285,'','9:00','13:30','4.5','','','','',' Invoice Amt: 285','2011-03-14 00:59:06','2013-03-18 06:44:54',NULL,NULL,0,NULL,NULL),(1713,'SFUSD Burton 1713',1052,'Baseball','2011-03-10',375,'','14:00','18:00','4','','','','',' Invoice Amt: 375','2011-03-14 01:07:00','2013-03-18 06:44:54',NULL,NULL,0,NULL,NULL),(1714,'Gateway HS 1714',1115,'Baseball','2011-03-11',572.5,'','13:30','20:00','6.5','','','','',' Invoice Amt: 572.5','2011-03-14 01:12:03','2013-03-18 06:44:54',NULL,NULL,0,NULL,NULL),(1715,'SFUSd Marshall 1715',1042,'','2011-03-15',393.75,'','14:30','18:45','4.25','','','','',' Invoice Amt: 393.75','2011-03-16 14:12:45','2013-03-18 06:44:54',NULL,NULL,0,NULL,NULL),(1716,'Lynn JCC 1716',1087,'oneway transfer from airport','2011-04-03',350,'','11:30','','','','350.00','','',' Invoice Amt: 350','2011-03-18 15:04:52','2013-03-18 06:44:54',NULL,NULL,0,NULL,NULL),(1717,'Lynn 1717',1091,'please provide $400.00 deposit','2011-04-07',1300,'','15:30','','one way transfer ','','1300.00','','',' Invoice Amt: 1300','2011-03-18 15:15:12','2013-03-18 06:44:54',NULL,NULL,0,NULL,NULL),(1718,'Lynn 1718',1105,'please provide $400.00 deposit','2011-04-09',1300,'','20:00','','','','1300.00','','',' Invoice Amt: 1300','2011-03-18 15:25:43','2013-03-18 06:44:54',NULL,NULL,0,NULL,NULL),(1719,'Lynn JCC 1719',1088,'Follow Itenerary','2011-04-03',850,'','11:30','16:30','5.5','','','','',' Invoice Amt: 850','2011-03-18 15:28:48','2013-03-18 06:44:54',NULL,NULL,0,NULL,NULL),(1720,'Eritron Transportation 1720',1090,'','2011-03-14',300,'','17:30','21:30','4','300.00','0','1220','2011-03-22','Paid with invoices 1727 and 1728 Invoice Amt: 300','2011-03-18 17:20:07','2013-03-18 06:44:54',NULL,NULL,0,NULL,NULL),(1721,'WCC Kennedy HS 1721',1136,'2nd stop to Wyotech','2011-03-15',726.25,'','8:20','15:45','7.25','726.25','0','00436436','2011-03-30',' Invoice Amt: 726.25','2011-03-18 17:26:36','2013-03-18 06:44:54',NULL,NULL,0,NULL,NULL),(1722,'WCC Kennedy HS 1722',1139,'2nd stop to 6000 Jst Sacramento State','2011-03-15',628.75,'','8:20','15:45','7.15','628.75','0','00436436','2011-03-30',' Invoice Amt: 628.75','2011-03-18 17:55:25','2013-03-18 06:44:54',NULL,NULL,0,NULL,NULL),(1723,'Conservatory Nicole 1723',1110,'Discount $50.00 ','2011-03-16',300,'','9:30','13:30','4','','','','',' Invoice Amt: 300','2011-03-18 18:07:36','2013-03-18 06:44:54',NULL,NULL,0,NULL,NULL),(1724,'Conservatory Nicole 1724',1147,'Field trip','2011-03-17',325,'','9:30','13:00','4','','','','',' Invoice Amt: 325','2011-03-18 18:17:29','2013-03-18 06:44:54',NULL,NULL,0,NULL,NULL),(1725,'SFUSD ISA 1725',1066,' G Softball','2011-03-17',325,'','14:00','One Way Transfer','','','','','',' Invoice Amt: 325','2011-03-18 18:27:46','2013-03-18 06:44:54',NULL,NULL,0,NULL,NULL),(1726,'SFUS Clarendon 1726',1131,' Field Trip','2011-03-17',425,'','9:30','14:30','5','','','','',' Invoice Amt: 425','2011-03-18 18:31:08','2013-03-18 06:44:54',NULL,NULL,0,NULL,NULL),(1727,'Eritron Transportation 1727',1150,'Marriott Hotel Burlingame','2011-03-17',300,'','   17:45','21:00','4','300.00','0','1220','2011-03-22',' Invoice Amt: 300','2011-03-18 20:42:39','2013-03-18 06:44:54',NULL,NULL,0,NULL,NULL),(1728,'Eritron Transportation 1728',1144,'Crown Hotel Burlingame','2011-03-17',325,'','18:00','22:30','4.5','325.00','0','1220','2011-03-22',' Invoice Amt: 325','2011-03-18 21:06:53','2013-03-18 06:44:54',NULL,NULL,0,NULL,NULL),(1729,'Professional Charter 1729',1149,'Parents to Game','2011-03-19',755,'','11:15','19:30','8.25','','','','','send by fax 3-21-2011 Invoice Amt: 755','2011-03-19 21:52:46','2013-03-18 06:44:54',NULL,NULL,0,NULL,NULL),(1730,'Quarry Lane 2nd grade 1730',651,'','2011-03-28',725,'','10:15','13:15','4','','725','','','-- Updated by patrick@simplesoftwaresf.com on 4/4/2012 at 10:46:53 PM\r\n Invoice Amt: 725','2011-03-21 10:20:43','2013-03-18 06:44:54',NULL,NULL,0,NULL,NULL),(1731,'Professional Omar',1148,'Sport','2011-03-19',493.75,'','10.45','16:00','5.25','','','','','Send by fax 3-21-2011 Invoice Amt: 493.75','2011-03-21 13:19:30','2013-03-18 06:44:54',NULL,NULL,0,NULL,NULL),(1732,'WCC Pinole 1732',1127,'','2011-03-15',1007.5,'','7:45','15:30','7.75','1007.5','0','00436436','2011-03-30',' Invoice Amt: 1007.5','2011-03-21 16:48:26','2013-03-18 06:44:54',NULL,NULL,0,NULL,NULL),(1733,'WCC Pinole 1733',977,'Field Trip','2011-03-17',1297.5,'','7:00','16:30','  9.5','1297.5','0','00436436','2011-03-30',' Invoice Amt: 1297.5','2011-03-21 19:46:03','2013-03-18 06:44:54',NULL,NULL,0,NULL,NULL),(1734,'Quarry Lane Kindergarten 1734',721,'Oakland Zoo','2011-03-28',725,'','9:00','13:00','4','','','','',' Invoice Amt: 725','2011-03-21 22:37:58','2013-03-18 06:44:54',NULL,NULL,0,NULL,NULL),(1735,'Quarry Lane Gretchen Kelleough 1735',1176,'One way transfer','2011-04-20',525,'','11:00','One way Transfer','3','','','','',' Invoice Amt: 525','2011-03-24 22:41:04','2013-03-18 06:44:54',NULL,NULL,0,NULL,NULL),(1736,'SFUSD June Jordan HS 1736',1054,'G Soccer','2011-03-22',375,'','14:30','18:30','4','','','','',' Invoice Amt: 375','2011-03-24 22:54:43','2013-03-18 06:44:54',NULL,NULL,0,NULL,NULL),(1737,'SFUSD Harvey Milk 1737',1162,' Has been pay by teacher $100.00','2011-03-24',100,'','15:40','17:00','3','100.00','0','','2011-03-24',' Invoice Amt: 100','2011-03-24 23:05:04','2013-03-18 06:44:54',NULL,NULL,0,NULL,NULL),(1738,'Nicole Conservatory 1738',1111,'','2011-03-23',468.75,'','9:15','13:30','4.25','','','','',' Invoice Amt: 468.75','2011-03-24 23:23:29','2013-03-18 06:44:54',NULL,NULL,0,NULL,NULL),(1739,'SFUSD SFCommunity School 1739',1135,'Track Field','2011-03-23',0,'','14:30','17:45','4','','','','',' Invoice Amt: 0','2011-03-24 23:30:49','2013-03-18 06:44:54',NULL,NULL,0,NULL,NULL),(1740,'Quarry Lane  Pleasanton Kinder 1740',922,'Field Trip','2011-04-12',698.75,'','08:15:00','14:00','5.75','698.75','0','233313','04-08-11',' Invoice Amt: 698.75','2011-03-29 14:41:13','2013-03-18 06:44:54',NULL,NULL,0,NULL,NULL),(1741,'Quarry Lane Kindergarten 1741',1187,'','2011-03-28',125,'','13:00','14:00','1','','','','',' Invoice Amt: 125','2011-03-30 22:57:41','2013-03-18 06:44:54',NULL,NULL,0,NULL,NULL),(1742,'WCC K 12 operations 1742',1170,'Total students 47 2)buses ','2011-03-26',775,'','7:00','14:00','7','','','','',' Invoice Amt: 775','2011-03-30 23:19:30','2013-03-18 06:44:54',NULL,NULL,0,NULL,NULL),(1743,'WCC De Anza HS 1743',1015,'','2011-03-30',573.75,'','14:45','19:00','4.25','','','','',' Invoice Amt: 573.75','2011-03-31 00:25:28','2013-03-18 06:44:54',NULL,NULL,0,NULL,NULL),(1744,'WCC Crespi MS 1744',979,'Field Trip','2011-03-31',450,'','07:00','11:00','4','','','','',' Invoice Amt: 450','2011-03-31 00:30:12','2013-03-18 06:44:54',NULL,NULL,0,NULL,NULL),(1745,'WCC DeJean MS 1745',1130,'f','2011-03-25',592.5,'','9:00','14:30','5.5','','','','',' Invoice Amt: 592.5','2011-03-31 00:49:50','2013-03-18 06:44:54',NULL,NULL,0,NULL,NULL),(1746,'Eriton transportation 1746',1143,'','2011-03-25',450,'','17:00','24:00','7','450.00','0','1223','04-06-11',' Invoice Amt: 450','2011-03-31 01:17:50','2013-03-18 06:44:54',NULL,NULL,0,NULL,NULL),(1747,'Eriton transportation 1747',1157,'','2011-03-26',512.5,'','17:30','1:45','8.25','512.50','0','1223','04-06-11',' Invoice Amt: 512.5','2011-03-31 01:35:05','2013-03-18 06:44:54',NULL,NULL,0,NULL,NULL),(1748,'Eriton transportation 1748',1177,'','2011-03-27',350,'','12:30','17:30','5','350.0','0','1223','04-06-11',' Invoice Amt: 350','2011-03-31 01:46:49','2013-03-18 06:44:54',NULL,NULL,0,NULL,NULL),(1749,'Eriton transportation 1749',1183,'','2011-03-29',300,'','17:30','21:30','4','300.00','0','1223','04-06-11',' Invoice Amt: 300','2011-03-31 01:53:24','2013-03-18 06:44:54',NULL,NULL,0,NULL,NULL),(1750,'Sandra Medina JCC 1750',774,'1)SFO Transfer + 5hrs','2011-03-27',810,'','13:30','20:30','7','','','','',' Invoice Amt: 810','2011-04-05 00:09:31','2013-03-18 06:44:54',NULL,NULL,0,NULL,NULL),(1751,'Sandra Medina JCC 1751',775,'','2011-03-28',1060,'','9:30','22:30','13','','','','',' Invoice Amt: 1060','2011-04-05 00:17:27','2013-03-18 06:44:54',NULL,NULL,0,NULL,NULL),(1752,'Sandra Medina JCC 1752',776,'','2011-03-29',1191.25,'','7:45','22:30','14.75','','','','',' Invoice Amt: 1191.25','2011-04-05 00:28:19','2013-03-18 06:44:54',NULL,NULL,0,NULL,NULL),(1753,'Sandra Medina JCC 1753',777,'','2011-03-30',1266.25,'','7:15','23:00','15.75','','','','',' Invoice Amt: 1266.25','2011-04-05 00:41:42','2013-03-18 06:44:54',NULL,NULL,0,NULL,NULL),(1754,'Sandra Medina JCC 1754',1104,'','2011-03-31',275,'','7:30','','','','','','',' Invoice Amt: 275','2011-04-05 00:55:53','2013-03-18 06:44:54',NULL,NULL,0,NULL,NULL),(1755,'GATEWAY HS Joe 1755',1179,'Baseball, deduct 30minute for meal','2011-04-01',572.5,'','13:30','20:30','6.5','','','','',' Invoice Amt: 572.5','2011-04-05 01:17:38','2013-03-18 06:44:54',NULL,NULL,0,NULL,NULL),(1756,'Richmond HS 1756',1140,'Field trip','2011-04-01',450,'','8:15','12:30','4','','','','',' Invoice Amt: 450','2011-04-05 01:24:38','2013-03-18 06:44:54',NULL,NULL,0,NULL,NULL),(1757,'De Anza HS 1757',1191,'Softball','2011-03-31',460,'','14:00','19:00','5','','','','',' Invoice Amt: 460','2011-04-05 01:30:14','2013-03-18 06:44:54',NULL,NULL,0,NULL,NULL),(1758,'WCC Crespi MS 1758',980,'Field trip','2011-04-02',450,'','12:00','2:00','4','','','','',' Invoice Amt: 450','2011-04-05 01:36:18','2013-03-18 06:44:54',NULL,NULL,0,NULL,NULL),(1759,'SFUSD Washington HS',1186,'Softball','2011-03-31',535,'','13:00','18:00','5','','','','',' Invoice Amt: 535','2011-04-05 01:53:50','2013-03-18 06:44:54',NULL,NULL,0,NULL,NULL),(1760,'Balboa HS Robi Conservancy 1760',1178,'Field trip','2011-04-09',0,'','9:15','13:15','4','','','','',' Invoice Amt: 0','2011-04-05 22:26:41','2013-03-18 06:44:54',NULL,NULL,0,NULL,NULL),(1761,'WCC De Anza HS 1761',1023,'','2011-03-25',573.75,'','14:45','19:00','4.25','','','','',' Invoice Amt: 573.75','2011-04-05 23:11:34','2013-03-18 06:44:54',NULL,NULL,0,NULL,NULL),(1762,'Lynn Rothman 1762',1106,'SFO Tranfer','2011-04-13',350,'','7:15','9:15','2','','','','',' Invoice Amt: 350','2011-04-05 23:23:11','2013-03-18 06:44:54',NULL,NULL,0,NULL,NULL),(1763,'Lynn Rothman 1763',1180,'','2011-04-06',385,'','14:45','19:00','4','','','','',' Invoice Amt: 385','2011-04-05 23:31:03','2013-03-18 06:44:54',NULL,NULL,0,NULL,NULL),(1764,'WCC De Anza HS 1764',1016,'','2011-04-01',645,'','14:00','19:00','5','','','','',' Invoice Amt: 645','2011-04-05 23:56:29','2013-03-18 06:44:54',NULL,NULL,0,NULL,NULL),(1765,'Quarry lane 1765',716,'First Grade to Santa Cruz','2011-04-15',1235.5,'','7:00','15:00','8','1235.50','0','23269','04-08-2011',' Invoice Amt: 1235.5','2011-04-10 21:37:47','2013-03-18 06:44:54',NULL,NULL,0,NULL,NULL),(1767,'Lynn Rothman 1767',1105,'Deposit was done $400.00','2011-04-09',900,'','20:00','One way transfer','','','','','',' Invoice Amt: 900','2011-04-11 09:55:11','2013-03-18 06:44:54',NULL,NULL,0,NULL,NULL),(1768,'Basque Club 1768',1214,'Charge as 2 transfer','2011-08-20',400,'','15:15','23:00','','','','','',' Invoice Amt: 400','2011-04-12 10:53:11','2013-03-18 06:44:54',NULL,NULL,0,NULL,NULL),(1769,'Nicole Mission Educational 1769',1124,'Mission Educational','2011-04-13',406.75,'','9:30','14:15','14.75','','','','',' Invoice Amt: 406.75','2011-04-13 14:29:45','2013-03-18 06:44:54',NULL,NULL,0,NULL,NULL),(1770,'SFUSD Burton 1770',1058,'','2011-04-05',375,'','14:30','18:30','4','','','','',' Invoice Amt: 375','2011-04-17 19:34:05','2013-03-18 06:44:54',NULL,NULL,0,NULL,NULL),(1771,'SFUSD Burton 1771',1059,'','2011-04-07',375,'','14:30','18:30','4','','','','',' Invoice Amt: 375','2011-04-17 19:41:08','2013-03-18 06:44:54',NULL,NULL,0,NULL,NULL),(1772,'SFUSD Community School 1772',1133,'','2011-04-08',375,'','14:30','17:45','4','','','','',' Invoice Amt: 375','2011-04-17 19:48:34','2013-03-18 06:44:54',NULL,NULL,0,NULL,NULL),(1773,'WCC De Anza HS 1773',1024,'','2011-04-06',573.75,'','14:45','19:00','4.25','','','','',' Invoice Amt: 573.75','2011-04-17 19:53:46','2013-03-18 06:44:54',NULL,NULL,0,NULL,NULL),(1774,'SFUSD Balboa HS 1774',1178,'Presidio','2011-04-09-',0,'','9:15','13:15','4','','','','',' Invoice Amt: 0','2011-04-17 22:05:18','2013-03-18 06:44:54',NULL,NULL,0,NULL,NULL),(1775,'Eritron Transportation 1775',1211,'2buses','2011-04-11',650,'','17:30','22:00','4.5','','','','',' Invoice Amt: 650','2011-04-17 22:21:18','2013-03-18 06:44:54',NULL,NULL,0,NULL,NULL),(1776,'GATEWAY HS Joe 1776',1197,'','2011-04-13',597.5,'','14:00','20:30','6.5','','','','',' Invoice Amt: 597.5','2011-04-17 22:34:06','2013-03-18 06:44:54',NULL,NULL,0,NULL,NULL),(1777,'GATEWAY HS Joe 1777',1198,'','2011-04-14',722.5,'','12:00','20:30','8.5','','','','',' Invoice Amt: 722.5','2011-04-17 22:41:56','2013-03-18 06:44:54',NULL,NULL,0,NULL,NULL),(1778,'WCC De Anza HS 1778',1025,'','2011-04-15',645,'','14:00','19:00','5','','','','',' Invoice Amt: 645','2011-04-17 22:58:23','2013-03-18 06:44:54',NULL,NULL,0,NULL,NULL),(1779,'Quarry lane Gabby 1779',1216,'Revise time for this charter 8:15 start and finish 15:30 addditional charge will be $156.50','2011-04-21',1181.75,'','8:30','14:30','','','','','',' Invoice Amt: 1181.75','2011-04-18 08:56:15','2013-03-18 06:44:54',NULL,NULL,0,NULL,NULL),(1780,'WCC De Anza HS 1780',1232,'Volleyball','2011-04-07',0,'','15:30','20:00','4.5','','','','',' Invoice Amt: 0','2011-04-18 22:40:54','2013-03-18 06:44:54',NULL,NULL,0,NULL,NULL),(1781,'GATEWAY HS Joe 1781',1117,'','2011-04-05',460,'','14:00','19:00','5','','','','',' Invoice Amt: 460','2011-04-18 23:26:15','2013-03-18 06:44:54',NULL,NULL,0,NULL,NULL),(1782,'Miguel Conservancy 1782',1209,'One Way transfer','2011-04-09',240,'','10:15','','','','','','',' Invoice Amt: 240','2011-04-18 23:36:00','2013-03-18 06:44:54',NULL,NULL,0,NULL,NULL),(1783,'Eritron Transportation 1783',1210,'','2011-04-09',325,'','18:15','22:30','4.25','','','','',' Invoice Amt: 325','2011-04-18 23:39:32','2013-03-18 06:44:54',NULL,NULL,0,NULL,NULL),(1784,'Jim Casey',1224,'','2011-04-15',540.75,'','12:35','18:45','6.25','','','','',' Invoice Amt: 540.75','2011-04-19 00:01:08','2013-03-18 06:44:54',NULL,NULL,0,NULL,NULL),(1785,'SFUSD ISA 1785',1071,'G Soccer Team','2011-04-07',325,'','14:00','One way transfer','','','','','',' Invoice Amt: 325','2011-04-19 00:10:01','2013-03-18 06:44:54',NULL,NULL,0,NULL,NULL),(1786,'Mission Education 1786',1123,'','2011-04-07',450,'','9:30','13:30','4','','','','',' Invoice Amt: 450','2011-04-19 00:14:10','2013-03-18 06:44:54',NULL,NULL,0,NULL,NULL),(1787,'SFUSD James Lick 1787',1118,'','2011-04-08',450,'','14:45','17:30','4','','','','',' Invoice Amt: 450','2011-04-19 00:20:00','2013-03-18 06:44:54',NULL,NULL,0,NULL,NULL),(1788,'SFUSD ISA 1788',1070,'G Soccer Team','2011-04-05',325,'','14:00','One way transfer','','','','','',' Invoice Amt: 325','2011-04-19 15:01:41','2013-03-18 06:44:54',NULL,NULL,0,NULL,NULL),(1789,'SFUSD Willie Brown 1789',855,'Track Field','2011-04-08',450,'','14:00','17:45','4','','','','',' Invoice Amt: 450','2011-04-19 15:06:51','2013-03-18 06:44:54',NULL,NULL,0,NULL,NULL),(1790,'SFUSD ISA 1790',1072,'G Soccer Team','2011-04-12',325,'','14:00','One Way Transfer','','','','','',' Invoice Amt: 325','2011-04-19 15:50:10','2013-03-18 06:44:54',NULL,NULL,0,NULL,NULL),(1791,'SFUSD Marshall 1791',1045,'Cancellation Spot','2011-04-14',375,'','14:30','18:45','4','','','','',' Invoice Amt: 375','2011-04-19 16:01:21','2013-03-18 06:44:54',NULL,NULL,0,NULL,NULL),(1792,'SFUSD Burton 1792',1053,'Baseball ','2011-04-14',375,'','14:00','18:00','4','','','','',' Invoice Amt: 375','2011-04-19 16:10:23','2013-03-18 06:44:54',NULL,NULL,0,NULL,NULL),(1793,'SFUSD Willie Brown 1793',856,'Track Field','2011-04-15',375,'','14:00','17:45','','','','','',' Invoice Amt: 375','2011-04-19 16:15:26','2013-03-18 06:44:54',NULL,NULL,0,NULL,NULL),(1794,'SFUSD Lowell 1794',1060,'Gymnastic','2011-04-18',662.5,'','16:00','22:30','6.5','','','','',' Invoice Amt: 662.5','2011-04-19 16:26:09','2013-03-18 06:44:54',NULL,NULL,0,NULL,NULL),(1795,'SFUSD Marshall 1795',1223,'G Soccer Team','2011-04-18',375,'','14:30','Cancel on Spot','','','','','',' Invoice Amt: 375','2011-04-19 16:40:01','2013-03-18 06:44:54',NULL,NULL,0,NULL,NULL),(1796,'WCC De Anza HS 1796',1017,'','2011-04-0',573.75,'','14:45','19:00','4.25','','','','',' Invoice Amt: 573.75','2011-04-20 21:57:55','2013-03-18 06:44:54',NULL,NULL,0,NULL,NULL),(1797,'WCC Richmond Hs 1797',1125,'Field Trip','2011-04-08',795,'','8:15','15:15','7','','','','',' Invoice Amt: 795','2011-04-20 22:02:49','2013-03-18 06:44:54',NULL,NULL,0,NULL,NULL),(1798,'WCC Crespi MS 1798',1151,'Field trip','2011-04-15',1390.5,'','9:00','15:00','6','','','','',' Invoice Amt: 1390.5','2011-04-20 22:13:58','2013-03-18 06:44:54',NULL,NULL,0,NULL,NULL),(1799,'SFUSD Lafayette 1799',1096,'Field trip','2011-04-20',250,'','9:45','','','','','','',' Invoice Amt: 250','2011-04-20 22:19:54','2013-03-18 06:44:54',NULL,NULL,0,NULL,NULL),(1800,'SFUSD Lafayette 1800',1097,'Field trip','2011-04-21',250,'','10:30','','','','','','',' Invoice Amt: 250','2011-04-20 22:35:56','2013-03-18 06:44:54',NULL,NULL,0,NULL,NULL),(1801,'SFUSD Washington HS 1801',1208,'Boys Golf','2011-04-21',581.25,'','13:45','20:30','6.75','','','','',' Invoice Amt: 581.25','2011-04-22 21:16:31','2013-03-18 06:44:54',NULL,NULL,0,NULL,NULL),(1802,'SFUSD James Lick 1802',1119,'','2011-04-22',450,'','14:45','17:45','4','','','','',' Invoice Amt: 450','2011-04-22 21:29:14','2013-03-18 06:44:54',NULL,NULL,0,NULL,NULL),(1803,'SFUSD June Jordan 1803',1055,'G Soccer','2011-04-21',375,'','14:30','18:30','4','','','','',' Invoice Amt: 375','2011-04-22 21:39:49','2013-03-18 06:44:54',NULL,NULL,0,NULL,NULL),(1804,'SFUSD ISA 1804',1069,'','2011-04-21',325,'','14:00','','','','','','',' Invoice Amt: 325','2011-04-27 11:49:10','2013-03-18 06:44:54',NULL,NULL,0,NULL,NULL),(1805,'Josh Conservancy 1805',1235,'Field trip','2011-04-23',857.5,'','9:00','15:30','6.5','','','','',' Invoice Amt: 857.5','2011-04-27 12:02:30','2013-03-18 06:44:54',NULL,NULL,0,NULL,NULL),(1806,'WCC De Anza 1806',1194,'Field Trip','2011-04-23',1591.5,'','7:15','16:00','8.75','','','','',' Invoice Amt: 1591.5','2011-04-27 12:25:34','2013-03-18 06:44:54',NULL,NULL,0,NULL,NULL),(1807,'WCC Richmond Hs 1807',1212,'Field trip','2011-4-26',497.5,'','11:30','17:00','5.5','','','','',' Invoice Amt: 497.5','2011-04-27 12:54:58','2013-03-18 06:44:54',NULL,NULL,0,NULL,NULL),(1808,'SFUSD Lowell 1808',1061,'Gymnastic','2011-04-26',556.25,'','16:45','22:00','5.25','','','','',' Invoice Amt: 556.25','2011-04-27 13:04:24','2013-03-18 06:44:54',NULL,NULL,0,NULL,NULL),(1809,'Quarry lane Zoo !st Grade 1809 ',1164,'Field trip','2011-05-10',1078.5,'','8:15','15:00','6.75','','','','',' Invoice Amt: 1078.5','2011-04-27 13:53:35','2013-03-18 06:44:54',NULL,NULL,0,NULL,NULL),(1810,'WCC De Anza HS 1810',1018,'','2011-04-27',598.5,'','13:45','19:00','5.25','','','','',' Invoice Amt: 598.5','2011-04-27 21:27:30','2013-03-18 06:44:54',NULL,NULL,0,NULL,NULL),(1811,'SFUSD Marshall 1811',1049,'baseball','2011-04-28',431.25,'','14:00','18:45','4.75','','431.25','','',' Invoice Amt: 431.25','2011-04-29 19:20:04','2013-03-18 06:44:54',NULL,NULL,0,NULL,NULL),(1812,'SFUSD INTN Sonya 1812 ',1073,'girls soccer       one way transfer','2011-04-28',325,'','14:00','','','','','','',' Invoice Amt: 325','2011-04-30 07:59:45','2013-03-18 06:44:54',NULL,NULL,0,NULL,NULL),(1813,'WCC De Anza 1813 ',1242,'sport','2011-04-28',385,'','15:45','19:00','','','385.00','','',' Invoice Amt: 385','2011-04-30 08:45:04','2013-03-18 06:44:54',NULL,NULL,0,NULL,NULL),(1814,'WCC De Anza 1814',1026,'softball','2011-04-30',573.75,'','14:45','19:00','4.25','','','','',' Invoice Amt: 573.75','2011-04-30 10:27:10','2013-03-18 06:44:54',NULL,NULL,0,NULL,NULL),(1815,'Eriton 1815',1239,'','2011-04-29',300,'','08:00','12:00','4','','300.00','','',' Invoice Amt: 300','2011-04-30 10:59:46','2013-03-18 06:44:54',NULL,NULL,0,NULL,NULL),(1816,'Coach America 1816',1241,'WO # 87669','2011-04-29',390,'','14:45','19:00','4','','390.00','','',' Invoice Amt: 390','2011-04-30 11:23:37','2013-03-18 06:44:54',NULL,NULL,0,NULL,NULL),(1817,'Eriton Transportation 1817',1243,'','2011-04-30',362.5,'','10:00','15:30','5.25','','','','','need to be send May 1st Juana Invoice Amt: 362.5','2011-05-01 22:54:33','2013-03-18 06:44:54',NULL,NULL,0,NULL,NULL),(1818,'Eriton 1818 ',1244,'','2011-04-30',225,'','17:15','19:00','','225','0','1243','',' Invoice Amt: 225','2011-05-02 15:39:10','2013-03-18 06:44:54',NULL,NULL,0,NULL,NULL),(1819,'Quarry Lane 1819',743,'received check for $840.00 but schedule was changed and went into OT. Leaving a balance of $260.00','2011-05-05',260,'','08:30','15:00','','840.00','-580','','',' Invoice Amt: 260','2011-05-03 09:32:21','2013-03-18 06:44:54',NULL,NULL,0,NULL,NULL),(1820,'Quarry Lane 1820 ',719,'first grade field trip','2011-06-09',1215.5,'','07:30','15:00','','','1215.50','','',' Invoice Amt: 1215.5','2011-05-03 09:35:10','2013-03-18 06:44:54',NULL,NULL,0,NULL,NULL),(1821,'Quarry Lane 1821',735,'5th grade ','2011-06-09',1025.5,'','08:30','17:00','8.5','','1025.50','','',' Invoice Amt: 1025.5','2011-05-03 09:48:55','2013-03-18 06:44:54',NULL,NULL,0,NULL,NULL),(1822,'WCC Verde 1822',1240,'1)bus 37pax 1)bus 27pax','2011-05-03',1245.75,'','08:30','14:45','6.25','','1245.75','','',' Invoice Amt: 1245.75','2011-05-03 10:07:06','2013-03-18 06:44:54',NULL,NULL,0,NULL,NULL),(1823,'Quarry Lane 1823',744,'one way transfer','2011-05-06',840,'','12:00','','','','840.00','','',' Invoice Amt: 840','2011-05-03 12:24:35','2013-03-18 06:44:54',NULL,NULL,0,NULL,NULL),(1824,'Quarry lane 1824',745,'','2011-05-12',670,'','8:30','14:30','','','670','','','-- Updated by patrick@simplesoftwaresf.com on 4/4/2012 at 10:05:55 PM\r\n Invoice Amt: 670','2011-05-04 11:58:21','2013-03-18 06:44:54',NULL,NULL,0,NULL,NULL),(1825,'WCC De Anza Sport 1825',1027,'softball','2011-05-04',645,'','14:00','19:00','5','','645.00','','',' Invoice Amt: 645','2011-05-05 12:08:20','2013-03-18 06:44:54',NULL,NULL,0,NULL,NULL),(1826,'WCC De Anza Sport 1826',1222,'volleyball','2011-05-04',512.5,'','14:30','20:00','5.5','','512.50','','',' Invoice Amt: 512.5','2011-05-05 12:12:08','2013-03-18 06:44:54',NULL,NULL,0,NULL,NULL),(1827,'Quarry Lane Sport 1827',1250,'Basketball','2011-05-04',450,'','15:30','19:30','4','','450.00','','',' Invoice Amt: 450','2011-05-05 12:17:37','2013-03-18 06:44:54',NULL,NULL,0,NULL,NULL),(1828,'Quarry lane 2nd Grade 1828',652,'','2011-06-01',1125,'','8:30','15:30','7','','1125','','','Invoice send May 7 2011 by Juana-- Updated by patrick@simplesoftwaresf.com on 4/4/2012 at 10:46:59 PM\r\n Invoice Amt: 1125','2011-05-07 12:19:45','2013-03-18 06:44:54',NULL,NULL,0,NULL,NULL),(1829,'Eriton 1829',1251,'','2011-05-05',350,'','17:15','22:15','5','','350.00','','',' Invoice Amt: 350','2011-05-09 11:28:19','2013-03-18 06:44:54',NULL,NULL,0,NULL,NULL),(1830,'Eriton Transportation 1830',1252,'','2011-05-05',350,'','17:15','22:15','5','','350.00','','',' Invoice Amt: 350','2011-05-09 12:11:07','2013-03-18 06:44:54',NULL,NULL,0,NULL,NULL),(1831,'SFUSD Sonya 1831',1062,'Gymnastics','2011-05-06',731.25,'','14:45','23:15','8.50','','731.25','','',' Invoice Amt: 731.25','2011-05-09 12:13:47','2013-03-18 06:44:54',NULL,NULL,0,NULL,NULL),(1832,'SFUSD Teresa 1832',1142,'Great America ','2011-05-06',750,'','09:00','20:00','','','750.00','','',' Invoice Amt: 750','2011-05-09 12:16:59','2013-03-18 06:44:54',NULL,NULL,0,NULL,NULL),(1833,'WCC De Anza 1833',1019,'varsity baseball','2011-05-06',573.75,'','14:45','19:00','4.25','','573.75','','',' Invoice Amt: 573.75','2011-05-09 12:24:44','2013-03-18 06:44:54',NULL,NULL,0,NULL,NULL),(1834,'Coach America 1834',1230,'','2011-05-09',540.75,'','9.50','16:00','6.25','','','','',' Invoice Amt: 540.75','2011-05-10 00:43:06','2013-03-18 06:44:54',NULL,NULL,0,NULL,NULL),(1835,'Coach America 1835',1229,'','2011-05-09',540.75,'','9.50','16:00','6.25','','','','',' Invoice Amt: 540.75','2011-05-10 00:49:16','2013-03-18 06:44:54',NULL,NULL,0,NULL,NULL),(1836,'WCC De Anza HS 1836',1020,'Baseball','2011-05-09',787.5,'','13:30','20:00','6.5','','','','',' Invoice Amt: 787.5','2011-05-10 10:16:36','2013-03-18 06:44:54',NULL,NULL,0,NULL,NULL),(1837,'SFUSD Lafayette 1837',1213,'','2011-05-10',797.5,'','8:30','18:30','10','','','','','I only charge $10.00 extra Invoice Amt: 797.5','2011-05-12 21:54:25','2013-03-18 06:44:54',NULL,NULL,0,NULL,NULL),(1838,'SFUSD Marina Middle 1838',1261,'','2011-05-11',500,'','8:45','15:00','6.25','','','','',' Invoice Amt: 500','2011-05-16 13:44:51','2013-03-18 06:44:54',NULL,NULL,0,NULL,NULL),(1839,'SFUSD Lowell 1838',1063,'','2011-05-13',487.5,'','16:45','22:30','5.75','','','','',' Invoice Amt: 487.5','2011-05-16 18:02:26','2013-03-18 06:44:54',NULL,NULL,0,NULL,NULL),(1840,'SFMB Hotel Prescott 1840',1257,'','2011-05-10',395,'','14:30','20:00','5.5','','','','',' Invoice Amt: 395','2011-05-16 21:27:56','2013-03-18 06:44:54',NULL,NULL,0,NULL,NULL),(1841,'WCC De Anza HS 1841',1028,'','2011-05-11',0,'','14:45','19:00','4.25','','','','',' Invoice Amt: 0','2011-05-16 21:37:03','2013-03-18 06:44:54',NULL,NULL,0,NULL,NULL),(1842,'El Dorado School Miguel 1842',1262,'','2011-05-13',240,'','10:30','One way transfer','','','','','',' Invoice Amt: 240','2011-05-16 21:46:30','2013-03-18 06:44:54',NULL,NULL,0,NULL,NULL),(1843,'Coach America 1843',1260,'','2011-05-13',429,'','19:15','21:45','4','','','','',' Invoice Amt: 429','2011-05-16 21:57:31','2013-03-18 06:44:54',NULL,NULL,0,NULL,NULL),(1844,'El Dorado School Miguel 1844',1263,'','2011-05-14',240,'','10-30','One way transfer','','','','','',' Invoice Amt: 240','2011-05-16 22:07:54','2013-03-18 06:44:54',NULL,NULL,0,NULL,NULL),(1845,'Professional Charter 1845',1269,'','2011-05-14',700,'','16:45','1:00','9.75','','','','',' Invoice Amt: 700','2011-05-16 22:12:51','2013-03-18 06:44:54',NULL,NULL,0,NULL,NULL),(1846,'Professional Charter 1846',1270,'','2011-05-14',537.5,'','9:15','16:00','6.75','','','','',' Invoice Amt: 537.5','2011-05-16 22:21:32','2013-03-18 06:44:54',NULL,NULL,0,NULL,NULL),(1847,'SFUSD Balboa 1847',1264,'','2011-05-15',350,'','9:00','17:15','','','','','',' Invoice Amt: 350','2011-05-16 22:28:19','2013-03-18 06:44:54',NULL,NULL,0,NULL,NULL),(1848,'WCC Richmond Hs 1848',1225,'','2011-05-13',1495.55,'','7:00','19:00','12','','','','',' Invoice Amt: 1495.55','2011-05-16 22:50:20','2013-03-18 06:44:54',NULL,NULL,0,NULL,NULL),(1849,'WCC Verde Elementary 1849',1181,'','2011-05-13',1245.75,'','8:30','14:45','6.25','','1245.75','','',' Invoice Amt: 1245.75','2011-05-17 22:14:11','2013-03-18 06:44:54',NULL,NULL,0,NULL,NULL),(1850,'WCC Verde Elementary 1850',1154,'','2011-05-13',1695.5,'','8:30','14:45','6.25','','1695.50','','',' Invoice Amt: 1695.5','2011-05-17 22:52:32','2013-03-18 06:44:54',NULL,NULL,0,NULL,NULL),(1851,'WCC Richmond Hs 1851',1217,'','2011-05-17',985.5,'','9:00','15:30','6.5','','','','',' Invoice Amt: 985.5','2011-05-17 23:36:41','2013-03-18 06:44:54',NULL,NULL,0,NULL,NULL),(1852,'WCC Martin Luther King 1852',1202,'','2011-05-17',720,'','8:15','15:30','7.25','','','','',' Invoice Amt: 720','2011-05-17 23:49:21','2013-03-18 06:44:54',NULL,NULL,0,NULL,NULL),(1853,'WCC De Anza HS',1276,'Volleyball','2011-05-17',385,'','16:45','20:45','4','','','','',' Invoice Amt: 385','2011-05-18 00:13:51','2013-03-18 06:44:54',NULL,NULL,0,NULL,NULL),(1854,'WCC Stege 1854',1219,'','2011-05-16',915,'','8:30','15:30','7','','','','',' Invoice Amt: 915','2011-05-18 00:24:27','2013-03-18 06:44:54',NULL,NULL,0,NULL,NULL),(1855,'Quarry Lane 1855',1278,'','2011-06-08',575,'','08:30','12:00','','','575.00','','',' Invoice Amt: 575','2011-05-18 18:59:10','2013-03-18 06:44:54',NULL,NULL,0,NULL,NULL),(1856,'WCC Peres Elementary 1856',1159,'Charge has been wave May 19 2011','2011-05-19',0,'','8:45','One way transfer','','','0','','',' Invoice Amt: 0','2011-05-19 10:21:13','2013-03-18 06:44:54',NULL,NULL,0,NULL,NULL),(1857,'SFUSD James Denman School',1265,'','2011-05-19',250,'','12:00','13:00','','','','','',' Invoice Amt: 250','2011-05-19 14:23:21','2013-03-18 06:44:54',NULL,NULL,0,NULL,NULL),(1858,'Conservancy Monroe Nicole 1858 ',1248,'','2011-05-19',400,'','9:30','13:30','4','','','','',' Invoice Amt: 400','2011-05-19 14:47:55','2013-03-18 06:44:54',NULL,NULL,0,NULL,NULL),(1859,'SFMB San Jose 1859',1273,'6hrs + 1hrs Traveling time','2011-5-18',0,'','11:00','17:00','7','','','','',' Invoice Amt: 0','2011-05-19 15:53:48','2013-03-18 06:44:54',NULL,NULL,0,NULL,NULL),(1860,'SFMB San Jose 27bus 1860',1272,'6hrs + 1hrs Traveling time','2011-05-18',0,'','11:00','17:00','7','','','','',' Invoice Amt: 0','2011-05-19 16:10:12','2013-03-18 06:44:54',NULL,NULL,0,NULL,NULL),(1861,'SFUSD Lowell HS 1861',1064,'','2011-05-19',325,'','16:00','One way transfer','','','','','',' Invoice Amt: 325','2011-05-19 16:34:08','2013-03-18 06:44:54',NULL,NULL,0,NULL,NULL),(1862,'Compass PO #94563 Att Dixon',1274,'','2011-05-17',570,'','18:00','1:00','7','','','','',' Invoice Amt: 570','2011-05-19 16:41:03','2013-03-18 06:44:54',NULL,NULL,0,NULL,NULL),(1863,'WCC Verde Elementary 1863',1153,'1)bus 59pax 1) bus 28pax','2011-05-19',1435.65,'','8:30','14:45','6.25','','','','',' Invoice Amt: 1435.65','2011-05-20 21:50:34','2013-03-18 06:44:54',NULL,NULL,0,NULL,NULL),(1864,'Brewery Adventure Amy 1864',1279,'','2011-05-22',570,'','11;15','19:30','7.75','','','','',' Invoice Amt: 570','2011-05-21 21:05:25','2013-03-18 06:44:54',NULL,NULL,0,NULL,NULL),(1865,'Eritron Transportation 1865',1286,'','2011-05-21',475,'','9:30','17:00','7.5','','','','',' Invoice Amt: 475','2011-05-21 21:20:33','2013-03-18 06:44:54',NULL,NULL,0,NULL,NULL),(1866,'WCC De Anza HS 1866',906,'Field trip 2way transfer','2011-05-20',400,'','8:30','15:30','','','','','',' Invoice Amt: 400','2011-05-21 21:44:56','2013-03-18 06:44:54',NULL,NULL,0,NULL,NULL),(1867,'WCC De Anza HS 1867',1021,'Varsity Baseball','2011-05-18',645,'','14:00','19:00','5','','','','',' Invoice Amt: 645','2011-05-21 21:57:28','2013-03-18 06:44:54',NULL,NULL,0,NULL,NULL),(1868,'Miguel Conservancy 1868',1255,'One Way transfer','2011-05-20',325,'','10:45','','','','','','',' Invoice Amt: 325','2011-05-21 22:04:58','2013-03-18 06:44:54',NULL,NULL,0,NULL,NULL),(1869,'WCC Kennedy HS 1869',1041,'Field trip','2011-05-20',0,'','8:00','18:00','10','','','','',' Invoice Amt: 0','2011-05-21 22:08:51','2013-03-18 06:44:54',NULL,NULL,0,NULL,NULL),(1870,'Miguel Conservancy 1870',1256,'','2011-05-22',325,'','11:00','One way transfer','','','','','',' Invoice Amt: 325','2011-05-21 22:13:33','2013-03-18 06:44:54',NULL,NULL,0,NULL,NULL),(1871,'WCC Richmond Hs 1871',1227,'Field trip','2011-05-20',1850.5,'','7:30','16:30','9','','','','',' Invoice Amt: 1850.5','2011-05-21 22:30:28','2013-03-18 06:44:54',NULL,NULL,0,NULL,NULL),(1872,'SFUSD Lowell 1872',1128,'Tennis','2011-05-20',872.5,'','6:30','17:00','10.5','','','','',' Invoice Amt: 872.5','2011-05-21 22:35:33','2013-03-18 06:44:54',NULL,NULL,0,NULL,NULL),(1873,'WCC Peres Elementary 1873',1160,'Field trip','2011-05-20',0,'','12:00','','','','','','',' Invoice Amt: 0','2011-05-21 22:39:45','2013-03-18 06:44:54',NULL,NULL,0,NULL,NULL),(1874,'Anthony Golden Gate 1874',1285,'Field trip','2011-05-20',325,'','10:00','14:00','4','','','','',' Invoice Amt: 325','2011-05-21 22:44:32','2013-03-18 06:44:54',NULL,NULL,0,NULL,NULL),(1875,'Need transportation 1875',1206,'Tip to driver $45.00 + Fuel $60.000','2011-05-21',595,'','17:30','1:30','8','','','','',' Invoice Amt: 595','2011-05-25 18:03:40','2013-03-18 06:44:54',NULL,NULL,0,NULL,NULL),(1876,'WCC De Anza 1876',1195,'','2011-05-24',0,'','8:15','15:30','','','','','',' Invoice Amt: 0','2011-05-25 21:00:26','2013-03-18 06:44:54',NULL,NULL,0,NULL,NULL),(1877,'Professional Charter 1877',1287,'','2011-05-24',350,'','15:15','17:45','4','','','','',' Invoice Amt: 350','2011-05-26 12:50:35','2013-03-18 06:44:54',NULL,NULL,0,NULL,NULL),(1878,'Earth Team Kevin 1878',1280,'Field trip','2011-05-25',325,'','8:30','12:30','','','','','',' Invoice Amt: 325','2011-05-26 12:59:33','2013-03-18 06:44:54',NULL,NULL,0,NULL,NULL),(1879,'WCC Richmond Hs 1879',1175,'Bus went into Overtime','2011-05-26',890.25,'','8:00','16:45','8.75','','','','',' Invoice Amt: 890.25','2011-05-26 13:06:50','2013-03-18 06:44:54',NULL,NULL,0,NULL,NULL),(1880,'Professional Charter Scott 1880',1291,'','2011-05-24',400,'','18:00','21:00','4','','','','',' Invoice Amt: 400','2011-05-26 13:26:56','2013-03-18 06:44:54',NULL,NULL,0,NULL,NULL),(1881,'WCC De Anza HS 1881',1195,'Field trip','2011-05-24',0,'','','','','','','','',' Invoice Amt: 0','2011-05-26 13:34:45','2013-03-18 06:44:54',NULL,NULL,0,NULL,NULL),(1882,'WCC De Anza HS 1882',1195,'1) bus 57pax + 1)bus 27pax','2011-05-24',1529.25,'','8:15','15:00','6.75','','','','',' Invoice Amt: 1529.25','2011-05-26 13:42:49','2013-03-18 06:44:54',NULL,NULL,0,NULL,NULL),(1883,'WCC Richmond Hs 1883',1228,'Field Trip Berkeley','2011-05-24',0,'','8:15','15:00','6.75','','','','',' Invoice Amt: 0','2011-05-26 13:56:23','2013-03-18 06:44:54',NULL,NULL,0,NULL,NULL),(1884,'WCC Verde Elementary 1884',1204,'Six Flag','2011-05-26',1342.5,'','8:30','14:45','6.25','','','','',' Invoice Amt: 1342.5','2011-05-26 14:16:37','2013-03-18 06:44:54',NULL,NULL,0,NULL,NULL),(1885,'Professional Charter Scott 1885',1289,'Moscone','2011-05-25',450,'','17:75','23:75','6','','','','',' Invoice Amt: 450','2011-05-26 14:29:01','2013-03-18 06:44:54',NULL,NULL,0,NULL,NULL),(1886,'Professional Charter Scott 1886',1290,'Moscone','2011-05-25',450,'','17:45','23:45','6','450.00','0','','',' Invoice Amt: 450','2011-05-26 14:37:43','2013-03-18 06:44:54',NULL,NULL,0,NULL,NULL),(1887,'Bay Area Beer Socials 1887',1288,'','12011-05-27',550,'','10:00','17:00','','','','','',' Invoice Amt: 550','2011-05-27 17:57:00','2013-03-18 06:44:54',NULL,NULL,0,NULL,NULL),(1888,'WCC Peres Elementary 1888',1174,' 2.15hrs over time','2011-05-27',703.75,'','8:25','16:45','8.25','','','','','Need to be send, May 27 2011 Juana Invoice Amt: 703.75','2011-05-27 21:45:36','2013-03-18 06:44:54',NULL,NULL,0,NULL,NULL),(1889,'WCC Pinole HS',1218,'Start 8:00am','2011-05-27',960.5,'','8:00','15:30','7.5','','','','','Need to be send May 27 2011 Juana Invoice Amt: 960.5','2011-05-27 21:50:45','2013-03-18 06:44:54',NULL,NULL,0,NULL,NULL),(1890,'WCC Richmond Hs 1890',1226,'Hispanic University','2011-05-27',645.5,'','8:30','15:30','7','','','','',' Invoice Amt: 645.5','2011-05-28 22:37:22','2013-03-18 06:44:54',NULL,NULL,0,NULL,NULL),(1891,'Professional Charter Scott 1891',1292,'Scott charter','2011-05-28',380,'','12:30','16:45','4.25','','','','',' Invoice Amt: 380','2011-05-30 21:52:59','2013-03-18 06:44:54',NULL,NULL,0,NULL,NULL),(1892,'SFUSD Teresa Mission HS 1892',1293,'','2011-06-09',580,'','09:15','16:00','6.75','','450.00','','',' Invoice Amt: 580','2011-06-02 14:07:52','2013-03-18 06:44:54',NULL,NULL,0,NULL,NULL),(1893,'SFUSD Teresa Mission 1893',1294,'','2011-06-10',525,'','09:15','15:15','6','','450.00','','',' Invoice Amt: 525','2011-06-02 14:26:23','2013-03-18 06:44:54',NULL,NULL,0,NULL,NULL),(1894,'Helms M.S Lana 1894',1199,'','2011-06-03',525,'','08:30','14:30','6','','','','',' Invoice Amt: 525','2011-06-02 15:14:58','2013-03-18 06:44:54',NULL,NULL,0,NULL,NULL),(1895,'WCC Verde Elementary 1895',1205,'2 buses 55passengers bus San Jose','2011-06-02',0,'','8:45','15:15','','','','','','Over time 30minutes need to be send Invoice Amt: 0','2011-06-02 21:10:07','2013-03-18 06:44:54',NULL,NULL,0,NULL,NULL),(1896,'WCC Highland Elem 1896',1234,'Field trip 2 buses','2011-05-30',0,'','8:30','One way transfer','7','','','','',' Invoice Amt: 0','2011-06-05 20:10:30','2013-03-18 06:44:54',NULL,NULL,0,NULL,NULL),(1897,'GTEAM 1897',1296,'','2011-06-04',350,'','14:45','18:30','4','','','','',' Invoice Amt: 350','2011-06-05 20:27:37','2013-03-18 06:44:54',NULL,NULL,0,NULL,NULL),(1898,'WCC Stege Elem 1898',1238,'Field trip','2011-05-31',0,'','8:45','14:30','5.75','','','','',' Invoice Amt: 0','2011-06-05 20:41:51','2013-03-18 06:44:54',NULL,NULL,0,NULL,NULL),(1899,'WCC Pinole HS 1899',1220,'Field trip','2011-06-02',662.5,'','8:30','15:00','6.5','','','','',' Invoice Amt: 662.5','2011-06-05 20:50:00','2013-03-18 06:44:54',NULL,NULL,0,NULL,NULL),(1900,'WCC Verde Elementary 1900',1156,'1)bus 55pax